Case number,AER form,Received date,Reporter,Country,Gender,Species,Breed,Drug,Reaction,Animals affected,Animals treated,Animals died
DEU-BIAHPV1P-23DE000007,"<a target=""_blank""  href=""/xmlpserver/EVVET3 PW NEW/Subject Area Contents/Public Website/Report (PDF)/AER.xdo?_xpf=&_xpt=1&_params%2FOracle%20BI%20EE%3A%3ADefaultApp%3A%3AEVVET3%20PR%20NEW%2FAER%3A%3Adimension%2FAER%20Id%3A%3Aattribute%3A%3Anoaggr%3A%3Axsd%3Adouble=20000119648&_xt=AER&_xf=pdf""> AER </a>",2023-01-23 00:00:00,Veterinarian,Germany,MALE,Horse,Pony (unspecified),"Prascend 1 mg tablets for horses, Previcox 57 mg - Chewable tablet",Restlessness,1,1,
DEU-BIAHPV1P-23DE000030,"<a target=""_blank""  href=""/xmlpserver/EVVET3 PW NEW/Subject Area Contents/Public Website/Report (PDF)/AER.xdo?_xpf=&_xpt=1&_params%2FOracle%20BI%20EE%3A%3ADefaultApp%3A%3AEVVET3%20PR%20NEW%2FAER%3A%3Adimension%2FAER%20Id%3A%3Aattribute%3A%3Anoaggr%3A%3Axsd%3Adouble=20000124118&_xt=AER&_xf=pdf""> AER </a>",2023-02-06 00:00:00,Veterinarian,Germany,MALE,Dog,Boxer (German Boxer),"PHEN-PRED, 50/1.5mg, Tableta, Phen-Pred  50 mg + 1,5 mg – Tabletten für Hunde, Phen-Pred 50 mg + 1,5 mg  Tabletten  für Hunde, Phen-Pred 50 mg + 1,5 mg tablety, Phen-Pred tabletta A.U.V., Previcox 227 mg - Chewable tablet","Elevated amylase, Elevated serum alkaline phosphatase (ALP), Eosinophilia, Hyperproteinaemia, Neurological disorder NOS, Recumbency, Reluctant to move",1,1,
DEU-BIAHPV1P-23DE000266,"<a target=""_blank""  href=""/xmlpserver/EVVET3 PW NEW/Subject Area Contents/Public Website/Report (PDF)/AER.xdo?_xpf=&_xpt=1&_params%2FOracle%20BI%20EE%3A%3ADefaultApp%3A%3AEVVET3%20PR%20NEW%2FAER%3A%3Adimension%2FAER%20Id%3A%3Aattribute%3A%3Anoaggr%3A%3Axsd%3Adouble=20000184845&_xt=AER&_xf=pdf""> AER </a>",2023-06-14 00:00:00,Veterinarian,Germany,UNKNOWN,Dog,"Collie (unspecified), Dog (unknown)",Previcox 227 mg - Chewable tablet,"Malaise, Tremor",1,1,
DEU-BIAHPV1P-23DE000411,"<a target=""_blank""  href=""/xmlpserver/EVVET3 PW NEW/Subject Area Contents/Public Website/Report (PDF)/AER.xdo?_xpf=&_xpt=1&_params%2FOracle%20BI%20EE%3A%3ADefaultApp%3A%3AEVVET3%20PR%20NEW%2FAER%3A%3Adimension%2FAER%20Id%3A%3Aattribute%3A%3Anoaggr%3A%3Axsd%3Adouble=20000212249&_xt=AER&_xf=pdf""> AER </a>",2023-08-04 00:00:00,Veterinarian,Germany,MALE,Dog,Chihuahua,"Fortekor 2.5 mg tablets for cats and dogs, Previcox 57 mg - Chewable tablet",Bloody diarrhoea,1,1,
DEU-BIAHPV1P-23DE000533,"<a target=""_blank""  href=""/xmlpserver/EVVET3 PW NEW/Subject Area Contents/Public Website/Report (PDF)/AER.xdo?_xpf=&_xpt=1&_params%2FOracle%20BI%20EE%3A%3ADefaultApp%3A%3AEVVET3%20PR%20NEW%2FAER%3A%3Adimension%2FAER%20Id%3A%3Aattribute%3A%3Anoaggr%3A%3Axsd%3Adouble=20000248832&_xt=AER&_xf=pdf""> AER </a>",2023-10-13 00:00:00,Veterinarian,Germany,MALE,Horse,Icelandic Pony,"Prascend 1 mg tablets for horses, Previcox 227 mg - Chewable tablet",Elevated temperature,1,1,
DEU-BIAHPV1P-23DE000619,"<a target=""_blank""  href=""/xmlpserver/EVVET3 PW NEW/Subject Area Contents/Public Website/Report (PDF)/AER.xdo?_xpf=&_xpt=1&_params%2FOracle%20BI%20EE%3A%3ADefaultApp%3A%3AEVVET3%20PR%20NEW%2FAER%3A%3Adimension%2FAER%20Id%3A%3Aattribute%3A%3Anoaggr%3A%3Axsd%3Adouble=20000272549&_xt=AER&_xf=pdf""> AER </a>",2023-11-28 00:00:00,Animal owner,Germany,FEMALE,Dog,Dog (other),Previcox 227 mg - Chewable tablet,"Diarrhoea, Stomach pain",1,1,
DEU-CA8B80A2-2023-DE-000042,"<a target=""_blank""  href=""/xmlpserver/EVVET3 PW NEW/Subject Area Contents/Public Website/Report (PDF)/AER.xdo?_xpf=&_xpt=1&_params%2FOracle%20BI%20EE%3A%3ADefaultApp%3A%3AEVVET3%20PR%20NEW%2FAER%3A%3Adimension%2FAER%20Id%3A%3Aattribute%3A%3Anoaggr%3A%3Axsd%3Adouble=20000198938&_xt=AER&_xf=pdf""> AER </a>",2023-07-10 00:00:00,Veterinarian,Germany,FEMALE,Dog,Greyhound - Spanish,"Daxocox 70 mg - Tablet, Previcox 227 mg - Chewable tablet, Previcox 57 mg - Chewable tablet, Previcox 8.2 mg/g - Oral paste",Haemorrhagic diarrhoea,1,1,
DEU-D72D2002-ESLETIVET-2022160,"<a target=""_blank""  href=""/xmlpserver/EVVET3 PW NEW/Subject Area Contents/Public Website/Report (PDF)/AER.xdo?_xpf=&_xpt=1&_params%2FOracle%20BI%20EE%3A%3ADefaultApp%3A%3AEVVET3%20PR%20NEW%2FAER%3A%3Adimension%2FAER%20Id%3A%3Aattribute%3A%3Anoaggr%3A%3Axsd%3Adouble=20000118889&_xt=AER&_xf=pdf""> AER </a>",2023-01-19 00:00:00,Veterinarian,Germany,MALE,Dog,Hound - Italian Coarse-haired,"Letifend (--) - Lyophilisate and solvent for solution for injection, Previcox 227 mg - Chewable tablet, Previcox 57 mg - Chewable tablet, Previcox 8.2 mg/g - Oral paste",Weakness,1,1,
DEU-DEUBVLVP-2023-01200,"<a target=""_blank""  href=""/xmlpserver/EVVET3 PW NEW/Subject Area Contents/Public Website/Report (PDF)/AER.xdo?_xpf=&_xpt=1&_params%2FOracle%20BI%20EE%3A%3ADefaultApp%3A%3AEVVET3%20PR%20NEW%2FAER%3A%3Adimension%2FAER%20Id%3A%3Aattribute%3A%3Anoaggr%3A%3Axsd%3Adouble=20000158413&_xt=AER&_xf=pdf""> AER </a>",2023-04-25 00:00:00,Veterinarian,Germany,FEMALE,Dog,Mountain Dog - Bernese,"Cimalgex 30 mg - Chewable tablet, Cimalgex 8 mg - Chewable tablet, Cimalgex 80 mg - Chewable tablet, Previcox 227 mg - Chewable tablet, Previcox 57 mg - Chewable tablet, Previcox 8.2 mg/g - Oral paste",Digestive tract haemorrhage NOS,1,1,
DEU-DEUBVLVP-2023-01312,"<a target=""_blank""  href=""/xmlpserver/EVVET3 PW NEW/Subject Area Contents/Public Website/Report (PDF)/AER.xdo?_xpf=&_xpt=1&_params%2FOracle%20BI%20EE%3A%3ADefaultApp%3A%3AEVVET3%20PR%20NEW%2FAER%3A%3Adimension%2FAER%20Id%3A%3Aattribute%3A%3Anoaggr%3A%3Axsd%3Adouble=20000164362&_xt=AER&_xf=pdf""> AER </a>",2023-05-10 00:00:00,Other health care professional,Germany,FEMALE,Human,Unknown,Previcox 227 mg - Chewable tablet,"Crying, Feeling restless",1,1,
DEU-DEUBVLVP-2023-03128,"<a target=""_blank""  href=""/xmlpserver/EVVET3 PW NEW/Subject Area Contents/Public Website/Report (PDF)/AER.xdo?_xpf=&_xpt=1&_params%2FOracle%20BI%20EE%3A%3ADefaultApp%3A%3AEVVET3%20PR%20NEW%2FAER%3A%3Adimension%2FAER%20Id%3A%3Aattribute%3A%3Anoaggr%3A%3Axsd%3Adouble=20000234072&_xt=AER&_xf=pdf""> AER </a>",2023-09-18 00:00:00,Veterinarian,Germany,FEMALE,Dog,Crossbred Canine/dog,"DUPHAMOX  LA, 150.0mg/ml, Injekční suspenze, DUPHAMOX LA, Duphamox LA, Duphamox LA 150 mg/ml Suspensie voor injectie, Duphamox LA 150 mg/ml injekčná suspenzia, Duphamox Long Acting, 150mg/ml, solution injectable pour bovins, ovins et porcins, Meloxidolor 20 mg/ml - Solution for injection, Meloxidolor 40 mg/ml - Solution for injection, Meloxidolor 5 mg/ml - Solution for injection, Previcox 227 mg - Chewable tablet","Abnormal histology NOS, Ascites, Diarrhoea, Gastric perforation, Gastritis, Lethargy (see also Central nervous system depression in Neurological), Vomiting",1,1,
DEU-DEUBVLVP-2023-03369,"<a target=""_blank""  href=""/xmlpserver/EVVET3 PW NEW/Subject Area Contents/Public Website/Report (PDF)/AER.xdo?_xpf=&_xpt=1&_params%2FOracle%20BI%20EE%3A%3ADefaultApp%3A%3AEVVET3%20PR%20NEW%2FAER%3A%3Adimension%2FAER%20Id%3A%3Aattribute%3A%3Anoaggr%3A%3Axsd%3Adouble=20000244591&_xt=AER&_xf=pdf""> AER </a>",2023-10-05 00:00:00,Veterinarian,Germany,MALE,Dog,Sheepdog - Shetland,Previcox 57 mg - Chewable tablet,"Disturbance in attention, Equilibrium disorder, Muscle tremor",1,1,
DEU-SELECVET-2023-0002,"<a target=""_blank""  href=""/xmlpserver/EVVET3 PW NEW/Subject Area Contents/Public Website/Report (PDF)/AER.xdo?_xpf=&_xpt=1&_params%2FOracle%20BI%20EE%3A%3ADefaultApp%3A%3AEVVET3%20PR%20NEW%2FAER%3A%3Adimension%2FAER%20Id%3A%3Aattribute%3A%3Anoaggr%3A%3Axsd%3Adouble=20000142664&_xt=AER&_xf=pdf""> AER </a>",2023-03-24 00:00:00,Animal owner,Germany,FEMALE,Dog,Unknown,"Caniphedrin-50 ad us. vet., Previcox 227 mg - Chewable tablet, Previcox 57 mg - Chewable tablet, Previcox 8.2 mg/g - Oral paste","Death by euthanasia, Renal failure, Vomiting, Weight loss",1,1,
DEU-ZOETISPV-2023-DE-00120,"<a target=""_blank""  href=""/xmlpserver/EVVET3 PW NEW/Subject Area Contents/Public Website/Report (PDF)/AER.xdo?_xpf=&_xpt=1&_params%2FOracle%20BI%20EE%3A%3ADefaultApp%3A%3AEVVET3%20PR%20NEW%2FAER%3A%3Adimension%2FAER%20Id%3A%3Aattribute%3A%3Anoaggr%3A%3Axsd%3Adouble=20000131357&_xt=AER&_xf=pdf""> AER </a>",2023-02-23 00:00:00,Veterinarian,Germany,MALE,Dog,Retriever - Golden,"Forthyron 200 Microgram Flavoured Tablet, Forthyron 200 microgram tablet, Forthyron 400 Microgram Flavoured Tablet, Forthyron 400 microgram tablet, Forthyron 600 Microgram Flavoured Tablet, Forthyron 800 Microgram Flavoured Tablet, Librela 10 mg - Solution for injection, Librela 15 mg - Solution for injection, Librela 20 mg - Solution for injection, Librela 30 mg - Solution for injection, Librela 5 mg - Solution for injection, Previcox 227 mg - Chewable tablet, Previcox 57 mg - Chewable tablet, Previcox 8.2 mg/g - Oral paste","Arthritis, Partial lack of efficacy",1,1,
DEU-ZOETISPV-2023-DE-00137,"<a target=""_blank""  href=""/xmlpserver/EVVET3 PW NEW/Subject Area Contents/Public Website/Report (PDF)/AER.xdo?_xpf=&_xpt=1&_params%2FOracle%20BI%20EE%3A%3ADefaultApp%3A%3AEVVET3%20PR%20NEW%2FAER%3A%3Adimension%2FAER%20Id%3A%3Aattribute%3A%3Anoaggr%3A%3Axsd%3Adouble=20000131725&_xt=AER&_xf=pdf""> AER </a>",2023-02-24 00:00:00,Veterinarian,Germany,MALE,Dog,Crossbred Canine/dog,"Librela 10 mg - Solution for injection, Librela 15 mg - Solution for injection, Librela 20 mg - Solution for injection, Librela 30 mg - Solution for injection, Librela 5 mg - Solution for injection, Previcox 227 mg - Chewable tablet, Previcox 57 mg - Chewable tablet, Previcox 8.2 mg/g - Oral paste","Drinking a lot, Elevated renal parameters, Increased urine volume, Lack of efficacy - NOS, Urinary incontinence",1,1,
DEU-ZOETISPV-2023-DE-00141,"<a target=""_blank""  href=""/xmlpserver/EVVET3 PW NEW/Subject Area Contents/Public Website/Report (PDF)/AER.xdo?_xpf=&_xpt=1&_params%2FOracle%20BI%20EE%3A%3ADefaultApp%3A%3AEVVET3%20PR%20NEW%2FAER%3A%3Adimension%2FAER%20Id%3A%3Aattribute%3A%3Anoaggr%3A%3Axsd%3Adouble=20000131713&_xt=AER&_xf=pdf""> AER </a>",2023-02-24 00:00:00,Veterinarian,Germany,FEMALE,Dog,Collie - Border,"Librela 10 mg - Solution for injection, Librela 15 mg - Solution for injection, Librela 20 mg - Solution for injection, Librela 30 mg - Solution for injection, Librela 5 mg - Solution for injection, Previcox 227 mg - Chewable tablet, Previcox 57 mg - Chewable tablet, Previcox 8.2 mg/g - Oral paste","Anaemia NOS, Hypercalcaemia, Hyperphosphataemia, Partial lack of efficacy, Polydipsia, Polyuria",1,1,
DNK-BIAHPV1P-23DK000015,"<a target=""_blank""  href=""/xmlpserver/EVVET3 PW NEW/Subject Area Contents/Public Website/Report (PDF)/AER.xdo?_xpf=&_xpt=1&_params%2FOracle%20BI%20EE%3A%3ADefaultApp%3A%3AEVVET3%20PR%20NEW%2FAER%3A%3Adimension%2FAER%20Id%3A%3Aattribute%3A%3Anoaggr%3A%3Axsd%3Adouble=20000137614&_xt=AER&_xf=pdf""> AER </a>",2023-03-12 00:00:00,Veterinarian,Denmark,MALE,Dog,Dog (other),"Cartrophen vet, Ketaminol 100 mg/ml - Injektionslösung für Tiere, Ketaminol Vet. 100 mg/ml injektionsvæske, opløsning, Ketaminol Vet. 50 mg/ml injektionsvæske, opløsning, Ketaminol vet 50 mg/ml injektioneste, liuos, Ketaminol vet. 100 mg/ml Injektionsvätska, lösning, Ketaminol vet. 50 mg/ml Injektionsvätska, lösning, Librela 10 mg - Solution for injection, Librela 15 mg - Solution for injection, Librela 20 mg - Solution for injection, Librela 30 mg - Solution for injection, Librela 5 mg - Solution for injection, Previcox 227 mg - Chewable tablet","Abdominal pain, Decreased appetite, Elevated C-reactive protein, Emesis, Fluid in abdomen NOS, Groaning, Hyperaemic mucous membrane, Hypersalivation, Laboured breathing, Lethargy (see also Central nervous system depression in Neurological), Lymphopenia, Malaise, Peritonitis, Pyloric ulcer, Tachycardia, Tachypnoea, Weight loss",1,1,
ESP-BIAHPV1P-23ES000008,"<a target=""_blank""  href=""/xmlpserver/EVVET3 PW NEW/Subject Area Contents/Public Website/Report (PDF)/AER.xdo?_xpf=&_xpt=1&_params%2FOracle%20BI%20EE%3A%3ADefaultApp%3A%3AEVVET3%20PR%20NEW%2FAER%3A%3Adimension%2FAER%20Id%3A%3Aattribute%3A%3Anoaggr%3A%3Axsd%3Adouble=20000118861&_xt=AER&_xf=pdf""> AER </a>",2023-01-19 00:00:00,Veterinarian,Spain,MALE,Dog,Crossbred Canine/dog,Previcox 227 mg - Chewable tablet,"Anxiety, Inappropriate urination, Restlessness",1,1,
ESP-BIAHPV1P-23ES000107,"<a target=""_blank""  href=""/xmlpserver/EVVET3 PW NEW/Subject Area Contents/Public Website/Report (PDF)/AER.xdo?_xpf=&_xpt=1&_params%2FOracle%20BI%20EE%3A%3ADefaultApp%3A%3AEVVET3%20PR%20NEW%2FAER%3A%3Adimension%2FAER%20Id%3A%3Aattribute%3A%3Anoaggr%3A%3Axsd%3Adouble=20000145375&_xt=AER&_xf=pdf""> AER </a>",2023-03-29 00:00:00,Veterinarian,Spain,MALE,Dog,Bulldog - French,Previcox 227 mg - Chewable tablet,"Abnormal stool colouration, Adrenal gland disorder NOS, Anxiety, Apathy, Crystalluria, Death by euthanasia, Decreased appetite, Dehydration, Elevated serum alkaline phosphatase (ALP), Elevated total bilirubin, Fever, Gall bladder & bile duct disorder NOS, Hepatic failure, Hepato-biliary disorder NOS, Jaundice, Neutrophilia, Pasty stool, Polydipsia, Polyuria, Spleen and reticulo-endothelial system disorder NOS, Tachycardia, Thrombocytopenia, Tremor, Vomiting, Weight loss",1,1,1
ESP-BIAHPV1P-23ES000152,"<a target=""_blank""  href=""/xmlpserver/EVVET3 PW NEW/Subject Area Contents/Public Website/Report (PDF)/AER.xdo?_xpf=&_xpt=1&_params%2FOracle%20BI%20EE%3A%3ADefaultApp%3A%3AEVVET3%20PR%20NEW%2FAER%3A%3Adimension%2FAER%20Id%3A%3Aattribute%3A%3Anoaggr%3A%3Axsd%3Adouble=20000158607&_xt=AER&_xf=pdf""> AER </a>",2023-04-25 00:00:00,Veterinarian,Spain,FEMALE,Dog,"Dog (unknown), Retriever - Labrador","Previcox 227 mg - Chewable tablet, SEMELCEF 1000 mg tablets for dogs, SEMELCEF 200 mg tablets for dogs and cats, Semelcef 1000 mg comprimidos para cães, Semelcef 200 mg comprimidos para cães e gatos","Abdominal cavity disorder NOS, Breathing difficulty, Death, Decreased appetite, Decreased drinking, Elevated amylase, Elevated blood urea nitrogen (BUN), Elevated cholesterol (total), Elevated creatine-kinase (CK), Elevated creatinine, Eosinophilia, Hyperphosphataemia, Hypoalbuminaemia, Hypothermia, Inversion of albumin/globulin ratio, Leucopenia NOS, Lymphocytosis, Thoracic transudate, Thrombocytopenia, Unable to stand, Unresponsive to stimuli, Vomiting",1,1,1
ESP-BIAHPV1P-23ES000203,"<a target=""_blank""  href=""/xmlpserver/EVVET3 PW NEW/Subject Area Contents/Public Website/Report (PDF)/AER.xdo?_xpf=&_xpt=1&_params%2FOracle%20BI%20EE%3A%3ADefaultApp%3A%3AEVVET3%20PR%20NEW%2FAER%3A%3Adimension%2FAER%20Id%3A%3Aattribute%3A%3Anoaggr%3A%3Axsd%3Adouble=20000170329&_xt=AER&_xf=pdf""> AER </a>",2023-05-18 00:00:00,Veterinarian,Spain,MALE,Dog,Dog (unknown),Previcox 227 mg - Chewable tablet,"Acute renal failure, Death, Not eating",1,1,1
ESP-BIAHPV1P-23ES000243,"<a target=""_blank""  href=""/xmlpserver/EVVET3 PW NEW/Subject Area Contents/Public Website/Report (PDF)/AER.xdo?_xpf=&_xpt=1&_params%2FOracle%20BI%20EE%3A%3ADefaultApp%3A%3AEVVET3%20PR%20NEW%2FAER%3A%3Adimension%2FAER%20Id%3A%3Aattribute%3A%3Anoaggr%3A%3Axsd%3Adouble=20000180882&_xt=AER&_xf=pdf""> AER </a>",2023-06-06 00:00:00,Veterinarian,Spain,MALE,Dog,Shepherd Dog - German,Previcox 227 mg - Chewable tablet,"Exercise intolerance, Muscle weakness NOS, Trembling",1,1,
ESP-BIAHPV1P-23ES000286,"<a target=""_blank""  href=""/xmlpserver/EVVET3 PW NEW/Subject Area Contents/Public Website/Report (PDF)/AER.xdo?_xpf=&_xpt=1&_params%2FOracle%20BI%20EE%3A%3ADefaultApp%3A%3AEVVET3%20PR%20NEW%2FAER%3A%3Adimension%2FAER%20Id%3A%3Aattribute%3A%3Anoaggr%3A%3Axsd%3Adouble=20000205160&_xt=AER&_xf=pdf""> AER </a>",2023-07-21 00:00:00,Veterinarian,Spain,MALE,Dog,"Dog (unknown), Retriever - Labrador","Metacam 5 mg/ml - Solution for injection (cats, dogs), Metacam 5 mg/ml - Solution for injection (cattle, pigs), Metacam 5 mg/ml - Solution for injection (dogs), Previcox 227 mg - Chewable tablet","Abnormal ultrasound finding, Anaemia NOS, Anxiety, Decreased haematocrit, Elevated alanine aminotransferase (ALT), Elevated amylase, Elevated aspartate aminotransferase (AST), Elevated blood urea nitrogen (BUN), Elevated creatine-kinase (CK), Elevated creatinine, Elevated lipase, Elevated serum alkaline phosphatase (ALP), Gastric distension, Hypoalbuminaemia, Impaired gastric function, Inflammatory bowel disorder, Lymphopenia, Neutrophilia, Pyloric ulcer, Tarry or black stool (see also haemorrhagic diarrhoea), Thrombocytosis, Vomiting, Weight loss",1,1,
ESP-BIAHPV1P-23ES000292,"<a target=""_blank""  href=""/xmlpserver/EVVET3 PW NEW/Subject Area Contents/Public Website/Report (PDF)/AER.xdo?_xpf=&_xpt=1&_params%2FOracle%20BI%20EE%3A%3ADefaultApp%3A%3AEVVET3%20PR%20NEW%2FAER%3A%3Adimension%2FAER%20Id%3A%3Aattribute%3A%3Anoaggr%3A%3Axsd%3Adouble=20000199881&_xt=AER&_xf=pdf""> AER </a>",2023-07-11 00:00:00,Veterinarian,Spain,MALE,Dog,Mastiff,Previcox 227 mg - Chewable tablet,Diarrhoea,1,1,
ESP-BIAHPV1P-23ES000484,"<a target=""_blank""  href=""/xmlpserver/EVVET3 PW NEW/Subject Area Contents/Public Website/Report (PDF)/AER.xdo?_xpf=&_xpt=1&_params%2FOracle%20BI%20EE%3A%3ADefaultApp%3A%3AEVVET3%20PR%20NEW%2FAER%3A%3Adimension%2FAER%20Id%3A%3Aattribute%3A%3Anoaggr%3A%3Axsd%3Adouble=20000273925&_xt=AER&_xf=pdf""> AER </a>",2023-11-30 00:00:00,Veterinarian,Spain,MALE,Dog,Dalmatian,Previcox 227 mg - Chewable tablet,"Drooling, Drooping eyelid, Earflap ptosis, Facial paralysis, Sensation loss",1,1,
ESP-BIAHPV1P-23ES000497,"<a target=""_blank""  href=""/xmlpserver/EVVET3 PW NEW/Subject Area Contents/Public Website/Report (PDF)/AER.xdo?_xpf=&_xpt=1&_params%2FOracle%20BI%20EE%3A%3ADefaultApp%3A%3AEVVET3%20PR%20NEW%2FAER%3A%3Adimension%2FAER%20Id%3A%3Aattribute%3A%3Anoaggr%3A%3Axsd%3Adouble=20000275389&_xt=AER&_xf=pdf""> AER </a>",2023-12-04 00:00:00,Veterinarian,Spain,UNKNOWN,Dog,Dog (unknown),Previcox 57 mg - Chewable tablet,Lack of efficacy - NOS,1,1,
ESP-ESPAGMED-2302023,"<a target=""_blank""  href=""/xmlpserver/EVVET3 PW NEW/Subject Area Contents/Public Website/Report (PDF)/AER.xdo?_xpf=&_xpt=1&_params%2FOracle%20BI%20EE%3A%3ADefaultApp%3A%3AEVVET3%20PR%20NEW%2FAER%3A%3Adimension%2FAER%20Id%3A%3Aattribute%3A%3Anoaggr%3A%3Axsd%3Adouble=20000256087&_xt=AER&_xf=pdf""> AER </a>",2023-10-27 00:00:00,Other health care professional,Spain,MALE,Human,Unknown,Previcox 57 mg - Chewable tablet,"Diarrhoea, Hyperthermia, Nausea, Vomiting",1,1,
ESP-F1A19E70-NLQBIOTICS_ST1289,"<a target=""_blank""  href=""/xmlpserver/EVVET3 PW NEW/Subject Area Contents/Public Website/Report (PDF)/AER.xdo?_xpf=&_xpt=1&_params%2FOracle%20BI%20EE%3A%3ADefaultApp%3A%3AEVVET3%20PR%20NEW%2FAER%3A%3Adimension%2FAER%20Id%3A%3Aattribute%3A%3Anoaggr%3A%3Axsd%3Adouble=20000153151&_xt=AER&_xf=pdf""> AER </a>",2023-04-13 00:00:00,Veterinarian,Spain,MALE,Dog,Boxer (German Boxer),"Previcox 227 mg - Chewable tablet, Previcox 57 mg - Chewable tablet, Previcox 8.2 mg/g - Oral paste, Stelfonta 1 mg/ml - Solution for injection","Injection site bleeding, Injection site oedema, Injection site serosanguinous discharge, Injection site ulcer, Lack of efficacy (neoplasia, no remission), Pain NOS",1,1,
ESP-ZOETISPV-2022-ES-00841,"<a target=""_blank""  href=""/xmlpserver/EVVET3 PW NEW/Subject Area Contents/Public Website/Report (PDF)/AER.xdo?_xpf=&_xpt=1&_params%2FOracle%20BI%20EE%3A%3ADefaultApp%3A%3AEVVET3%20PR%20NEW%2FAER%3A%3Adimension%2FAER%20Id%3A%3Aattribute%3A%3Anoaggr%3A%3Axsd%3Adouble=20000121110&_xt=AER&_xf=pdf""> AER </a>",2023-01-27 00:00:00,Veterinarian,Spain,MALE,Dog,Crossbred Canine/dog,"Librela 10 mg - Solution for injection, Librela 15 mg - Solution for injection, Librela 20 mg - Solution for injection, Librela 30 mg - Solution for injection, Librela 5 mg - Solution for injection, Previcox 227 mg - Chewable tablet","Lack of efficacy - NOS, Moist dermatitis, Pruritus, Skin lesion NOS, Suppurative dermatitis",1,1,
ESP-ZOETISPV-2023-ES-00148,"<a target=""_blank""  href=""/xmlpserver/EVVET3 PW NEW/Subject Area Contents/Public Website/Report (PDF)/AER.xdo?_xpf=&_xpt=1&_params%2FOracle%20BI%20EE%3A%3ADefaultApp%3A%3AEVVET3%20PR%20NEW%2FAER%3A%3Adimension%2FAER%20Id%3A%3Aattribute%3A%3Anoaggr%3A%3Axsd%3Adouble=20000138415&_xt=AER&_xf=pdf""> AER </a>",2023-03-14 00:00:00,Veterinarian,Spain,MALE,Dog,Crossbred Canine/dog,"Palladia 10 mg  - Film-coated tablet, Previcox 57 mg - Chewable tablet",Lymphopenia,1,1,
ESP-ZOETISPV-2023-ES-00526,"<a target=""_blank""  href=""/xmlpserver/EVVET3 PW NEW/Subject Area Contents/Public Website/Report (PDF)/AER.xdo?_xpf=&_xpt=1&_params%2FOracle%20BI%20EE%3A%3ADefaultApp%3A%3AEVVET3%20PR%20NEW%2FAER%3A%3Adimension%2FAER%20Id%3A%3Aattribute%3A%3Anoaggr%3A%3Axsd%3Adouble=20000204152&_xt=AER&_xf=pdf""> AER </a>",2023-07-20 00:00:00,Veterinarian,Spain,MALE,Dog,Crossbred Canine/dog,"Librela 10 mg - Solution for injection, Librela 15 mg - Solution for injection, Librela 20 mg - Solution for injection, Librela 30 mg - Solution for injection, Librela 5 mg - Solution for injection, Previcox 227 mg - Chewable tablet, Previcox 57 mg - Chewable tablet, Previcox 8.2 mg/g - Oral paste, Tramadog 50 mg tablet for dogs","Ataxia, Disorientation",1,1,
ESP-ZOETISPV-2023-ES-00585,"<a target=""_blank""  href=""/xmlpserver/EVVET3 PW NEW/Subject Area Contents/Public Website/Report (PDF)/AER.xdo?_xpf=&_xpt=1&_params%2FOracle%20BI%20EE%3A%3ADefaultApp%3A%3AEVVET3%20PR%20NEW%2FAER%3A%3Adimension%2FAER%20Id%3A%3Aattribute%3A%3Anoaggr%3A%3Axsd%3Adouble=20000208962&_xt=AER&_xf=pdf""> AER </a>",2023-07-31 00:00:00,Veterinarian,Spain,MALE,Dog,Pointing Dog - German Short-haired,"Librela 10 mg - Solution for injection, Librela 15 mg - Solution for injection, Librela 20 mg - Solution for injection, Librela 30 mg - Solution for injection, Librela 5 mg - Solution for injection, Previcox 227 mg - Chewable tablet",Arthritis,1,1,
ESP-ZOETISPV-2023-ES-01193,"<a target=""_blank""  href=""/xmlpserver/EVVET3 PW NEW/Subject Area Contents/Public Website/Report (PDF)/AER.xdo?_xpf=&_xpt=1&_params%2FOracle%20BI%20EE%3A%3ADefaultApp%3A%3AEVVET3%20PR%20NEW%2FAER%3A%3Adimension%2FAER%20Id%3A%3Aattribute%3A%3Anoaggr%3A%3Axsd%3Adouble=20000273122&_xt=AER&_xf=pdf""> AER </a>",2023-11-29 00:00:00,Veterinarian,Spain,FEMALE,Dog,Dog (other),"GLUCANTIME, GLUCANTIME 300 mg/ml SOLUCION INYECTABLE, Glucantime 300 mg/ml solução injectavel para cães, Librela 10 mg - Solution for injection, Librela 15 mg - Solution for injection, Librela 20 mg - Solution for injection, Librela 30 mg - Solution for injection, Librela 5 mg - Solution for injection, Previcox 57 mg - Chewable tablet","Abnormal menace reflex test, Blood in vomit, Cardiorespiratory arrest, Colitis, Cranial nerve paralysis, Death, Depressed ocular reflex, Elevated alanine aminotransferase (ALT), Elevated creatinine, Elevated lipase, Elevated serum alkaline phosphatase (ALP), Elevated total bilirubin, Fainting, Gastritis, Hyperphosphataemia, Hypoalbuminaemia, Hypoglycaemia, Hypoproteinaemia, Leucocytosis NOS, Localised oedema (not application site), Lymphocytosis, Melaena, Miosis, Monocytosis, Neutrophilia, Prolonged capillary refill time, Prostration, Reluctant to move, Status epilepticus, Vagal shock, Yellow mucous membranes",1,1,1
FIN-FINAMVET-20230184,"<a target=""_blank""  href=""/xmlpserver/EVVET3 PW NEW/Subject Area Contents/Public Website/Report (PDF)/AER.xdo?_xpf=&_xpt=1&_params%2FOracle%20BI%20EE%3A%3ADefaultApp%3A%3AEVVET3%20PR%20NEW%2FAER%3A%3Adimension%2FAER%20Id%3A%3Aattribute%3A%3Anoaggr%3A%3Axsd%3Adouble=20000248809&_xt=AER&_xf=pdf""> AER </a>",2023-10-13 00:00:00,Veterinarian,Finland,MALE,Dog,Dog (unknown),"Apoquel 16 mg - Chewable tablet, Bravecto 1000 mg - Chewable tablet, Librela 20 mg - Solution for injection, Previcox 227 mg - Chewable tablet","Convulsion, Death by euthanasia, Disorientation, Epileptic seizure, Foaming at the mouth, Head tremor, Panting, Polydipsia, Tachycardia, Urination related to convulsion, Wheezing",1,1,1
FRA-BIAHPV1P-23FR000064,"<a target=""_blank""  href=""/xmlpserver/EVVET3 PW NEW/Subject Area Contents/Public Website/Report (PDF)/AER.xdo?_xpf=&_xpt=1&_params%2FOracle%20BI%20EE%3A%3ADefaultApp%3A%3AEVVET3%20PR%20NEW%2FAER%3A%3Adimension%2FAER%20Id%3A%3Aattribute%3A%3Anoaggr%3A%3Axsd%3Adouble=20000128320&_xt=AER&_xf=pdf""> AER </a>",2023-02-15 00:00:00,Veterinarian,France,MALE,Dog,Retriever - Golden,Previcox 227 mg - Chewable tablet,"Death, Elevated blood urea nitrogen (BUN), Elevated cholesterol (total), Elevated creatinine, Elevated serum alkaline phosphatase (ALP), Elevated total bilirubin, Gall bladder & bile duct disorder NOS, Hypercalcaemia, Hypernatremia, Hyperphosphataemia, Hypokalaemia, Intestinal perforation, Lethargy (see also Central nervous system depression in Neurological), Leucopenia NOS, Lymphopenia, Neutropenia, Other abnormal test result NOS, Peritonitis, Shock",1,1,1
