Case number,AER form,Received date,Reporter,Country,Gender,Species,Breed,Drug,Reaction,Animals affected,Animals treated,Animals died
USA-BIAHPV1P-23US002940,"<a target=""_blank""  href=""/xmlpserver/EVVET3 PW NEW/Subject Area Contents/Public Website/Report (PDF)/AER.xdo?_xpf=&_xpt=1&_params%2FOracle%20BI%20EE%3A%3ADefaultApp%3A%3AEVVET3%20PR%20NEW%2FAER%3A%3Adimension%2FAER%20Id%3A%3Aattribute%3A%3Anoaggr%3A%3Axsd%3Adouble=20000132165&_xt=AER&_xf=pdf""> AER </a>",2023-02-25 00:00:00,Animal owner,United States,MALE,Dog,Boxer (German Boxer),Previcox 227 mg - Chewable tablet,"Ataxia, Confused, Lethargy (see also Central nervous system depression in Neurological), Polydipsia",1,1,
USA-BIAHPV1P-23US003080,"<a target=""_blank""  href=""/xmlpserver/EVVET3 PW NEW/Subject Area Contents/Public Website/Report (PDF)/AER.xdo?_xpf=&_xpt=1&_params%2FOracle%20BI%20EE%3A%3ADefaultApp%3A%3AEVVET3%20PR%20NEW%2FAER%3A%3Adimension%2FAER%20Id%3A%3Aattribute%3A%3Anoaggr%3A%3Axsd%3Adouble=20000127113&_xt=AER&_xf=pdf""> AER </a>",2023-02-14 00:00:00,Other health care professional,United States,MALE,Dog,Retriever - Golden,"Apoquel 16 mg - Chewable tablet, Apoquel 16 mg - Film-coated tablet, Apoquel 3.6 mg - Chewable tablet, Apoquel 3.6 mg - Film-coated tablet, Apoquel 5.4 mg - Chewable tablet, Apoquel 5.4 mg - Film-coated tablet, CARDOTEK 30 PLUS 272 mcg / 652 mg COMPRIMIDOS MASTICABLES, NexGard 136 mg - Chewable tablet, Previcox 227 mg - Chewable tablet","Abdominal effusion, Abnormal ultrasound finding, Cardiac arrest, Death, Decreased percentage of reticulocytes, Elevated alanine aminotransferase (ALT), Elevated blood urea nitrogen (BUN), Elevated creatinine, Fluid from nose, Fluid in abdomen NOS, Gastric ulcer, Hyperglycaemia, Hypoalbuminaemia, Hypocalcaemia, Hypochloraemia, Hypokalaemia, Hyponatremia, Hypoproteinaemia, Lethargy (see also Central nervous system depression in Neurological), Leucopenia NOS, Low pancreatic enzymes, Lymphopenia, Other abnormal test result NOS, Polyuria, Reduced globulins, Urinary tract infection",1,1,1
USA-BIAHPV1P-23US003112,"<a target=""_blank""  href=""/xmlpserver/EVVET3 PW NEW/Subject Area Contents/Public Website/Report (PDF)/AER.xdo?_xpf=&_xpt=1&_params%2FOracle%20BI%20EE%3A%3ADefaultApp%3A%3AEVVET3%20PR%20NEW%2FAER%3A%3Adimension%2FAER%20Id%3A%3Aattribute%3A%3Anoaggr%3A%3Axsd%3Adouble=20000132153&_xt=AER&_xf=pdf""> AER </a>",2023-02-25 00:00:00,Veterinarian,United States,MALE,Dog,Shepherd Dog - Australian,Previcox 227 mg - Chewable tablet,Urinary incontinence,1,1,
USA-BIAHPV1P-23US004602,"<a target=""_blank""  href=""/xmlpserver/EVVET3 PW NEW/Subject Area Contents/Public Website/Report (PDF)/AER.xdo?_xpf=&_xpt=1&_params%2FOracle%20BI%20EE%3A%3ADefaultApp%3A%3AEVVET3%20PR%20NEW%2FAER%3A%3Adimension%2FAER%20Id%3A%3Aattribute%3A%3Anoaggr%3A%3Axsd%3Adouble=20000137191&_xt=AER&_xf=pdf""> AER </a>",2023-03-09 00:00:00,Other health care professional,United States,MALE,Dog,Mastiff,Previcox 227 mg - Chewable tablet,"Death, Fluid in abdomen NOS, Intestinal perforation, Pancreatitis NOS, Vomiting",1,1,1
USA-BIAHPV1P-23US005384,"<a target=""_blank""  href=""/xmlpserver/EVVET3 PW NEW/Subject Area Contents/Public Website/Report (PDF)/AER.xdo?_xpf=&_xpt=1&_params%2FOracle%20BI%20EE%3A%3ADefaultApp%3A%3AEVVET3%20PR%20NEW%2FAER%3A%3Adimension%2FAER%20Id%3A%3Aattribute%3A%3Anoaggr%3A%3Axsd%3Adouble=20000138335&_xt=AER&_xf=pdf""> AER </a>",2023-03-14 00:00:00,Veterinarian,United States,FEMALE,Dog,Retriever - Labrador,Previcox 227 mg - Chewable tablet,"Lethargy (see also Central nervous system depression in Neurological), Surgical site disorder, Vomiting",1,1,
USA-BIAHPV1P-23US005689,"<a target=""_blank""  href=""/xmlpserver/EVVET3 PW NEW/Subject Area Contents/Public Website/Report (PDF)/AER.xdo?_xpf=&_xpt=1&_params%2FOracle%20BI%20EE%3A%3ADefaultApp%3A%3AEVVET3%20PR%20NEW%2FAER%3A%3Adimension%2FAER%20Id%3A%3Aattribute%3A%3Anoaggr%3A%3Axsd%3Adouble=20000135855&_xt=AER&_xf=pdf""> AER </a>",2023-03-07 00:00:00,Other health care professional,United States,MALE,Dog,Retriever - Labrador,"ANTISEDAN, ANTISEDAN 5 mg/ml SOLUCIÓN INYECTABLE PARA PERROS Y GATOS, ANTISEDAN 5 mg/ml raztopina za injiciranje za pse in mačke, ANTISEDAN 5MG/ML ΕΝΕΣΙΜΟ ΔΙΑΛΥΜΑ, ANTISEDAN SOLUTION INJECTABLE POUR CHIENS ET CHATS, ANTISEDAN, 5 mg/mL, otopina za injekciju, za pse i mačke, Antisedan 5 mg/ 1 ml, roztwór do wstrzykiwań dla psów i kotów, Antisedan 5 mg/ml  Injektionslösung für Hunde und Katzen, Antisedan 5 mg/ml - Injektionslösung für Hunde und Katzen, Antisedan 5 mg/ml Oplossing voor injectie, Antisedan 5 mg/ml Solution injectable, Antisedan 5 mg/ml injekčný roztok, Antisedan 5 mg/ml oldatos injekció kutya és macska részére.A.U.V., Antisedan 5 mg/ml solution for injection, Antisedan 5 mg/ml solução injetável para cães e gatos, Antisedan Vet 5 mg/ml injekcinis tirpalas, Antisedan Vet 5 mg/ml šķīdums injekcijām, Antisedan Vet, 5 mg/ml süstelahus, Antisedan Vet. 5 mg/ml injektionsvæske, opløsning, Antisedan vet 5 mg/ml injektioneste, liuos, Antisedan vet. 5 mg/ml Injektionsvätska, lösning, Antisedan vet. 5 mg/ml Stungulyf, lausn Handa hundum og köttum., Antisedan vet. 5 mg/ml injeksjonsvæske, oppløsning, til hund og katt, Antisedan vet., 5 mg/ml, Injektionsvätska, lösning, Antisedan, 5 mg/ml oplossing voor injectie voor honden en katten, Antisedan, 5mg/ml, Injekční roztok, CLINDAMYCIN 75 mg tablety, Clindamycin 75mg, Clindamycin, 75mg, Tableta, Fuxien vet 1000 mg/g inhalaatiohöyry, neste, ISOFLURANE-Vet 1000 mg/g liquido per inalazione per cani e gatti, ISOFLURIN 1000mg/g ΥΓΡΟ ΓΙΑ ΕΙΣΠΝΕΟΜΕΝΟΥΣ ΑΤΜΟΥΣ, Isoflurane 100% Inhalation Vapour, Liquid, Isoflurane 1000 mg/g Inhalation Vapour, liquid., Loxicom 0.5 mg/ml  - Oral suspension (cats), Loxicom 0.5 mg/ml  - Oral suspension (dogs), Loxicom 1 mg  - Chewable tablet (dogs), Loxicom 1.5 mg/ml  - Oral suspension (dogs), Loxicom 2.5 mg  - Chewable tablet (dogs), Loxicom 20 mg/ml - Solution for injection (cattle, pigs, horses), Loxicom 5 mg/ml  - Solution for injection (cats, dogs), Loxicom 50 mg/g  - Oral paste (horses), Previcox 227 mg - Chewable tablet, АНТИСЕДАН ВЕТ 5 mg/ml инжекционен разтвор","Death by euthanasia, Elevated blood urea nitrogen (BUN), Elevated creatinine, Elevated globulins, Eosinopenia, Hyperproteinaemia, Increased red blood cell count, Lethargy (see also Central nervous system depression in Neurological), Vomiting",1,1,1
USA-BIAHPV1P-23US005867,"<a target=""_blank""  href=""/xmlpserver/EVVET3 PW NEW/Subject Area Contents/Public Website/Report (PDF)/AER.xdo?_xpf=&_xpt=1&_params%2FOracle%20BI%20EE%3A%3ADefaultApp%3A%3AEVVET3%20PR%20NEW%2FAER%3A%3Adimension%2FAER%20Id%3A%3Aattribute%3A%3Anoaggr%3A%3Axsd%3Adouble=20000138387&_xt=AER&_xf=pdf""> AER </a>",2023-03-14 00:00:00,Animal owner,United States,FEMALE,Dog,Dog (unknown),Previcox 227 mg - Chewable tablet,"Anorexia, Irregular breathing, Lethargy (see also Central nervous system depression in Neurological), Not himself/herself",1,1,
USA-BIAHPV1P-23US006949,"<a target=""_blank""  href=""/xmlpserver/EVVET3 PW NEW/Subject Area Contents/Public Website/Report (PDF)/AER.xdo?_xpf=&_xpt=1&_params%2FOracle%20BI%20EE%3A%3ADefaultApp%3A%3AEVVET3%20PR%20NEW%2FAER%3A%3Adimension%2FAER%20Id%3A%3Aattribute%3A%3Anoaggr%3A%3Axsd%3Adouble=20000142370&_xt=AER&_xf=pdf""> AER </a>",2023-03-23 00:00:00,Other,United States,MALE,Dog,Shepherd Dog - Australian,Previcox 57 mg - Chewable tablet,"Anxiety, Itching, Reddening of the skin, Vocalisation, Vomiting",1,1,
USA-BIAHPV1P-23US007631,"<a target=""_blank""  href=""/xmlpserver/EVVET3 PW NEW/Subject Area Contents/Public Website/Report (PDF)/AER.xdo?_xpf=&_xpt=1&_params%2FOracle%20BI%20EE%3A%3ADefaultApp%3A%3AEVVET3%20PR%20NEW%2FAER%3A%3Adimension%2FAER%20Id%3A%3Aattribute%3A%3Anoaggr%3A%3Axsd%3Adouble=20000148508&_xt=AER&_xf=pdf""> AER </a>",2023-04-07 00:00:00,Veterinarian,United States,MALE,Horse,Thoroughbred,"Prascend 1 mg tablets for horses, Prascend, 1 mg, Tablett, Prascend, 1 mg, tablett, Previcox 227 mg - Chewable tablet",Other abnormal test result NOS,1,1,
USA-BIAHPV1P-23US007832,"<a target=""_blank""  href=""/xmlpserver/EVVET3 PW NEW/Subject Area Contents/Public Website/Report (PDF)/AER.xdo?_xpf=&_xpt=1&_params%2FOracle%20BI%20EE%3A%3ADefaultApp%3A%3AEVVET3%20PR%20NEW%2FAER%3A%3Adimension%2FAER%20Id%3A%3Aattribute%3A%3Anoaggr%3A%3Axsd%3Adouble=20000148524&_xt=AER&_xf=pdf""> AER </a>",2023-04-06 00:00:00,Animal owner,United States,MALE,Dog,Retriever - Labrador,Previcox 227 mg - Chewable tablet,Vomiting,1,1,
USA-BIAHPV1P-23US008496,"<a target=""_blank""  href=""/xmlpserver/EVVET3 PW NEW/Subject Area Contents/Public Website/Report (PDF)/AER.xdo?_xpf=&_xpt=1&_params%2FOracle%20BI%20EE%3A%3ADefaultApp%3A%3AEVVET3%20PR%20NEW%2FAER%3A%3Adimension%2FAER%20Id%3A%3Aattribute%3A%3Anoaggr%3A%3Axsd%3Adouble=20000152851&_xt=AER&_xf=pdf""> AER </a>",2023-04-12 00:00:00,Other health care professional,United States,FEMALE,Dog,Schnauzer - Giant,Previcox 227 mg - Chewable tablet,Vomiting,1,1,
USA-BIAHPV1P-23US008531,"<a target=""_blank""  href=""/xmlpserver/EVVET3 PW NEW/Subject Area Contents/Public Website/Report (PDF)/AER.xdo?_xpf=&_xpt=1&_params%2FOracle%20BI%20EE%3A%3ADefaultApp%3A%3AEVVET3%20PR%20NEW%2FAER%3A%3Adimension%2FAER%20Id%3A%3Aattribute%3A%3Anoaggr%3A%3Axsd%3Adouble=20000142889&_xt=AER&_xf=pdf""> AER </a>",2023-03-26 00:00:00,Veterinarian,United States,FEMALE,Dog,Ridgeback - Rhodesian,"CARDOTEK 30 PLUS 272 mcg / 652 mg COMPRIMIDOS MASTICABLES, NexGard 136 mg - Chewable tablet, Previcox 227 mg - Chewable tablet","Abnormal adrenocorticotropic hormone (ACTH) stimulation test, Abnormal radiograph finding, Blood in urine, Death, Decreased urine concentration, Electrolyte disorder, Elevated cholesterol (total), Elevated creatinine, Elevated globulins, Elevated serum alkaline phosphatase (ALP), Elevated symmetrical dimethylarginine (SDMA), Facial swelling (see also Skin), Hives (see also Skin), Hyperglycaemia, Hyperkalaemia, Hyperphosphataemia, Hyperproteinaemia, Hypoalbuminaemia, Hypocalcaemia, Hypochloraemia, Hyponatremia, Inappetence, Inversion of albumin/globulin ratio, Lethargy (see also Central nervous system depression in Neurological), Leucocytosis NOS, Low sodium-potassium ratio (Na:K ratio), Low thyroxine (T4), Monocytosis, Neutrophilia, Other abnormal test result NOS, Proteinuria, Vomiting",1,1,1
USA-BIAHPV1P-23US009122,"<a target=""_blank""  href=""/xmlpserver/EVVET3 PW NEW/Subject Area Contents/Public Website/Report (PDF)/AER.xdo?_xpf=&_xpt=1&_params%2FOracle%20BI%20EE%3A%3ADefaultApp%3A%3AEVVET3%20PR%20NEW%2FAER%3A%3Adimension%2FAER%20Id%3A%3Aattribute%3A%3Anoaggr%3A%3Axsd%3Adouble=20000159824&_xt=AER&_xf=pdf""> AER </a>",2023-04-27 00:00:00,Other health care professional,United States,FEMALE,Dog,Pit Bull,Previcox 227 mg - Chewable tablet,"Decreased appetite, Decreased urine concentration, Elevated blood urea nitrogen (BUN), Elevated creatinine, Inappropriate urination, Polydipsia, Polyuria, Renal disorder NOS",1,1,
USA-BIAHPV1P-23US010213,"<a target=""_blank""  href=""/xmlpserver/EVVET3 PW NEW/Subject Area Contents/Public Website/Report (PDF)/AER.xdo?_xpf=&_xpt=1&_params%2FOracle%20BI%20EE%3A%3ADefaultApp%3A%3AEVVET3%20PR%20NEW%2FAER%3A%3Adimension%2FAER%20Id%3A%3Aattribute%3A%3Anoaggr%3A%3Axsd%3Adouble=20000152500&_xt=AER&_xf=pdf""> AER </a>",2023-04-12 00:00:00,Veterinarian,United States,MALE,Dog,Retriever - Labrador,"Previcox 227 mg - Chewable tablet, Torbugesic 10 mg/ml Solution for Injection, Torbugesic Vet 10 mg/ml solution injectable pour chevaux, chiens et chats, Torbugesic Vet. 10 mg/ml injektionsvæske, opløsning, Torbuphanol Vet 10 mg/ml solution for injection for injection for horses, dogs and cats","Abnormal radiograph finding, Intestinal perforation, Vomiting",1,1,
USA-BIAHPV1P-23US011514,"<a target=""_blank""  href=""/xmlpserver/EVVET3 PW NEW/Subject Area Contents/Public Website/Report (PDF)/AER.xdo?_xpf=&_xpt=1&_params%2FOracle%20BI%20EE%3A%3ADefaultApp%3A%3AEVVET3%20PR%20NEW%2FAER%3A%3Adimension%2FAER%20Id%3A%3Aattribute%3A%3Anoaggr%3A%3Axsd%3Adouble=20000246547&_xt=AER&_xf=pdf""> AER </a>",2023-10-10 00:00:00,Animal owner,United States,MALE,Dog,Pug,"Previcox 57 mg - Chewable tablet, SYNULOX (200+50)MG/TAB ΔΙΣΚΙΟ, SYNULOX (40+10)MG/TAB ΔΙΣΚΙΟ, SYNULOX 140 mg/ml + 35 mg/ml suspensión inyectable, SYNULOX 200 mg/50 mg tablety pre psy a mačky, SYNULOX 200/50 mg COMPRIMIDOS APETITOSOS PARA PERROS, SYNULOX 250 COMPRIMES POUR CHIENS, SYNULOX 250 mg, SYNULOX 250 mg kramtomosios tabletės šunims ir katėms, SYNULOX 250 mg tablete za pse in mačke, SYNULOX 250mg, δισκία για σκύλους και γάτες, SYNULOX 40 mg/10 mg tablety pre psy a mačky, SYNULOX 40 mg/ml + 10 mg/ml POLVO PARA GOTAS ORALES EN SUSPENSION, SYNULOX 40/10 MG COMPRIMIDOS APETITOSOS PARA PERROS Y GATOS, SYNULOX 400 mg/100 mg tablety pre psy, SYNULOX 400/100 mg COMPRIMIDOS APETITOSOS PARA PERROS, SYNULOX 50 COMPRIMES POUR CHIENS ET CHATS, SYNULOX 50 mg, SYNULOX 50 mg kramtomosios tabletės šunims ir katėms, SYNULOX 50 mg tablete za pse in mačke, SYNULOX 500 COMPRIMES POUR CHIENS, SYNULOX 500 mg kramtomosios tabletės šunims, SYNULOX 500 mg tablete za pse, SYNULOX 500 mg, kramtomosios tabletės šunims, SYNULOX 500MG/TAB ΔΙΣΚΙΟ, SYNULOX 50mg, δισκία για σκύλους και γάτες, SYNULOX OGIVETTES POUR VEAUX, SYNULOX SUSPENSION INJECTABLE POUR BOVINS, SYNULOX VET 140 mg/ml injektioneste, suspensio koiralle, kissalle ja sialle, SYNULOX suspensão injetável para suínos, bovinos, cães e gatos, SYNULOX vet 200 mg/50 mg tabletti, koiralle ja kissalle, SYNULOX vet 40 mg/10 mg tabletti, koiralle ja kissalle, SYNULOX vet 400 mg/100 mg tabletti, koiralle, SYNULOX, 400/100mg, Tableta, Synulox 250 mg Comprimés Appétents, Synulox 250 mg Smakelijke tabletten, Synulox 250 mg tabletes suņiem un kaķiem, Synulox 250 mg, tabletid koertele ja kassidele, Synulox 250 mg, таблетки за кучета и котки, Synulox 250mg, Synulox 50 mg Comprimés Appétents, Synulox 50 mg Smakelijke Tabletten, Synulox 50 mg tabletes suņiem un kaķiem, Synulox 50 mg, tabletid koertele ja kassidele, Synulox 50 mg, таблетки за кучета и котки, Synulox 500 mg Bolus 400 mg - 100 mg Omhulde tablet, Synulox 500 mg Comprimés Appétents, Synulox 500 mg Smakelijke Tabletten, Synulox 500 mg tabletes suņiem, Synulox 500 mg, tabletid koertele, Synulox 500mg, Synulox 50mg, Synulox Bolus 500 mg, 400 mg + 100 mg comprimés enrobés pour veaux, Synulox Lactating Cow Intramammary suspension., Synulox Tabletki 250 mg, Synulox Tabletki 250 mg (200+50) mg/tablete; tabletes suņiem, Synulox Tabletki 50 mg, Synulox Tabletki 50 mg (40+10) mg/ tablete; tabletes suņiem un kaķiem, Synulox Tabletki 500 mg, Synulox Vet. til hund og kat 200 + 50 mg tabletter, Synulox Vet. til hund og kat 40 + 10 mg tabletter, Synulox Vet. til hund tabletter 400 + 100 mg, Synulox Vet. til kalve 400 + 100 mg tabletter, Synulox comprimidos palatáveis 250 mg para cães e gatos, Synulox comprimidos palatáveis 50 mg para cães e gatos, Synulox comprimidos palatáveis 500 mg para cães, Synulox vet 40 mg/ml jauhe oraalisuspensiota varten koiralle ja kissalle, Synulox vet. 200 mg tabletter for hund og katt, Synulox vet. 200 mg/50 mg Tablett, Synulox vet. 40 mg tabletter for hund og katt, Synulox vet. 40 mg/10 mg Tablett, Synulox vet. 400 mg tabletter for hund, Synulox vet. 400 mg/100 mg Tablett, Synulox, 200/50mg, Tableta, Synulox, 40/10mg, Tableta, Synulox-Kalb","Abnormal movement NOS, Agitation, Application site skin change NOS, Flaking skin, Hiding, Scratching, Vocalisation",1,1,
USA-BIAHPV1P-23US013061,"<a target=""_blank""  href=""/xmlpserver/EVVET3 PW NEW/Subject Area Contents/Public Website/Report (PDF)/AER.xdo?_xpf=&_xpt=1&_params%2FOracle%20BI%20EE%3A%3ADefaultApp%3A%3AEVVET3%20PR%20NEW%2FAER%3A%3Adimension%2FAER%20Id%3A%3Aattribute%3A%3Anoaggr%3A%3Axsd%3Adouble=20000159248&_xt=AER&_xf=pdf""> AER </a>",2023-04-26 00:00:00,Veterinarian,United States,FEMALE,Dog,Retriever - Labrador,"CARDOTEK 30 PLUS 272 mcg / 652 mg COMPRIMIDOS MASTICABLES, Previcox 227 mg - Chewable tablet","Death by euthanasia, Elevated temperature, Falling",1,1,1
USA-BIAHPV1P-23US014489,"<a target=""_blank""  href=""/xmlpserver/EVVET3 PW NEW/Subject Area Contents/Public Website/Report (PDF)/AER.xdo?_xpf=&_xpt=1&_params%2FOracle%20BI%20EE%3A%3ADefaultApp%3A%3AEVVET3%20PR%20NEW%2FAER%3A%3Adimension%2FAER%20Id%3A%3Aattribute%3A%3Anoaggr%3A%3Axsd%3Adouble=20000161835&_xt=AER&_xf=pdf""> AER </a>",2023-05-03 00:00:00,Other health care professional,United States,MALE,Dog,Shepherd Dog - German,"CARDOTEK 30 PLUS 272 mcg / 652 mg COMPRIMIDOS MASTICABLES, NexGard 136 mg - Chewable tablet, Previcox 227 mg - Chewable tablet, RABISIN SUSPENSION INJECTABLE, RABISIN injekčná suspenzia pre psy, mačky, fretky, hovädzí dobytok, kone a ovce, RABISIN suspenzija za injiciranje, RABISIN vet, injeksjonsvæske, suspensjon Vaksine mot rabies til dyr (inaktivert), RABISIN, Injekční suspenze, RABISIN, injekcinė suspensija, RABISIN, sospensione iniettabile per cani, gatti, equini, bovini, ovini, RABISIN, suspensie injectabilă, RABISIN, ενέσιμο εναιώρημα, RABISIN, ≥ 2,09 log10 OD50 i ≥ 1 I.J., suspenzija za injekciju za pse, mačke, pitome vretice, konje, govedo i ovce, Rabisin, Rabisin  Suspensie voor injectie, Rabisin Glikoproteiny wirusa wścieklizny nie mniej niż 1IU Zawiesina do wstrzykiwań, Rabisin Injektionssuspension für Hunde, Katzen, Marderartige, Pferde, Rinder und Schafe, Rabisin Vet. injektionsvæske, suspension, Rabisin suspensija injekcijām liellopiem, zirgiem, aitām, suņiem, kaķiem un mājas seskiem, Rabisin suspension injectable, Rabisin suspensão injectável, Rabisin vakcina A.U.V., Rabisin vet injektioneste, suspensio, Rabisin vet.  Injektionsvätska, suspension, Rabisin, Injektionssuspension für Hunde, Katzen, Marderartige, Pferde, Rinder und Schafe, Rabisin, suspensie voor injectie voor hond, kat en rund, Rabisin, süstesuspensioon, РАБИЗИН",Hot spot (pyotraumatic dermatitis),1,1,
USA-BIAHPV1P-23US016004,"<a target=""_blank""  href=""/xmlpserver/EVVET3 PW NEW/Subject Area Contents/Public Website/Report (PDF)/AER.xdo?_xpf=&_xpt=1&_params%2FOracle%20BI%20EE%3A%3ADefaultApp%3A%3AEVVET3%20PR%20NEW%2FAER%3A%3Adimension%2FAER%20Id%3A%3Aattribute%3A%3Anoaggr%3A%3Axsd%3Adouble=20000201253&_xt=AER&_xf=pdf""> AER </a>",2023-07-13 00:00:00,Other health care professional,United States,FEMALE,Dog,Retriever - Golden,"Previcox 227 mg - Chewable tablet, Simparica 10 mg - Chewable tablet, Simparica 120 mg - Chewable tablet, Simparica 20 mg - Chewable tablet, Simparica 40 mg - Chewable tablet, Simparica 5 mg - Chewable tablet, Simparica 80 mg - Chewable tablet","Anorexia, Dehydration, Elevated alanine aminotransferase (ALT), Elevated serum alkaline phosphatase (ALP), Hepatic tumour, Lethargy (see also Central nervous system depression in Neurological), Vomiting, Weight loss",1,1,
USA-BIAHPV1P-23US016762,"<a target=""_blank""  href=""/xmlpserver/EVVET3 PW NEW/Subject Area Contents/Public Website/Report (PDF)/AER.xdo?_xpf=&_xpt=1&_params%2FOracle%20BI%20EE%3A%3ADefaultApp%3A%3AEVVET3%20PR%20NEW%2FAER%3A%3Adimension%2FAER%20Id%3A%3Aattribute%3A%3Anoaggr%3A%3Axsd%3Adouble=20000177180&_xt=AER&_xf=pdf""> AER </a>",2023-05-31 00:00:00,Animal owner,United States,MALE,Dog,Boxer (German Boxer),"Previcox 227 mg - Chewable tablet, RIMADYL 100 mg COMPRIMIDOS MASTICABLES PARA PERROS, RIMADYL 100 mg comprimate pentru câini, RIMADYL 100 mg, kramtomosios tabletės šunims, RIMADYL 100MG/TAB ΜΑΣΩΜΕΝΟ ΔΙΣΚΙΟ, RIMADYL 20 mg COMPRIMIDOS MASTICABLES PARA PERROS, RIMADYL 20 mg, kramtomosios tabletės šunims, RIMADYL 20MG/TAB ΜΑΣΩΜΕΝΟ ΔΙΣΚΙΟ, RIMADYL 50 mg COMPRIMIDOS MASTICABLES PARA PERROS, RIMADYL 50 mg comprimate pentru câini, RIMADYL 50 mg, kramtomosios tabletės šunims, RIMADYL 50MG/TAB ΜΑΣΩΜΕΝΟ ΔΙΣΚΙΟ, RIMADYL 50mg/ml ενέσιμο διάλυμα για σκύλους και γάτες, RIMADYL CATTLE 50 mg/ml, injekcinis tirpalas galvijams, RIMADYL Cattle 50 mg/ml Solution for Injection, RIMADYL INJECTABLE, RIMADYL Injection 50mg/ml Διαυγές αποστειρωμένο ενέσιμο διάλυμα για σκύλους και γάτες, RIMADYL SMAKELIJKE TABLETTEN 100 mg voor honden, RIMADYL SMAKELIJKE TABLETTEN 50 mg voor honden, RIMADYL VET 50 mg/ml injektioneste, liuos, RIMADYL vet 100 mg purutabletti, RIMADYL vet 20 mg purutabletti, RIMADYL vet 50 mg purutabletti, Rimadyl 100 mg - Kautabletten für Hunde, Rimadyl 100 mg Comprimés Appétents 100 mg Tablet, Rimadyl 100 mg Kautablette für Hunde, Rimadyl 100 mg comprimidos mastigáveis para cães, Rimadyl 100 mg comprimés appétents, 100 mg, comprimés pour chiens, Rimadyl 100 mg okusne, žvečljive tablete za pse, Rimadyl 100 mg tabletes suņiem, Rimadyl 100 mg ízesített tabletta A.U.V., Rimadyl 20 mg - Kautabletten für Hunde, Rimadyl 20 mg Comprimés Appétents 20 mg Comprimé, Rimadyl 20 mg Comprimés Appétents 20 mg Tablet, Rimadyl 20 mg Kautablette für Hunde, Rimadyl 20 mg okusne, žvečljive tablete za pse, Rimadyl 20 mg ízesített tabletta A.U.V., Rimadyl 20 mg таблетки за кучета/Rimadyl 50 mg таблетки за кучета/Rimadyl 100 mg таблетки за кучета, Rimadyl 50 mg - Kautabletten für Hunde, Rimadyl 50 mg Comprimés Appétents 50 mg Tablet, Rimadyl 50 mg Kautablette für Hunde, Rimadyl 50 mg comprimidos mastigáveis para cães, Rimadyl 50 mg comprimés appétents, 50 mg, comprimés pour chiens, Rimadyl 50 mg košļājamās tabletes suņiem, Rimadyl 50 mg okusne, žvečljive tablete za pse, Rimadyl 50 mg ízesített tabletta A.U.V., Rimadyl 50 mg/ml - Injektionslösung für Hunde und Katzen, Rimadyl 50 mg/ml injekčný roztok, Rimadyl 50mg/ml Injektionslösung für Hunde und Katzen, Rimadyl Cattle, 50 mg/mL, otopina za injekciju, za goveda, Rimadyl Iniettabile 50 mg/ml, soluzione iniettabile per cane e gatto., Rimadyl Palatable 100 mg tablety pre psy, Rimadyl Palatable 20 mg tablety pre psy, Rimadyl Palatable 50 mg tablety pre psy, Rimadyl Palatable Tablets 100, Rimadyl Palatable Tablets 100 mg, Rimadyl Palatable Tablets 100 mg tabletes suņiem, Rimadyl Palatable Tablets 20 mg, Rimadyl Palatable Tablets 20 mg tabletes suņiem, Rimadyl Palatable Tablets 50, Rimadyl Palatable Tablets 50 mg, Rimadyl Palatable Tablets 50 mg tabletes suņiem, Rimadyl Palatable Tablets da 100 mg per cani, Rimadyl Palatable Tablets da 20 mg per cani, Rimadyl Palatable Tablets da 50 mg per cani, Rimadyl Palatable, 100mg, Žvýkací tableta, Rimadyl Palatable, 20mg, Žvýkací tableta, Rimadyl Palatable, 50mg, Žvýkací tableta, Rimadyl Solution for Injection for dogs and cats 50 mg/ml, Rimadyl Vet. 100 mg tyggetabletter, Rimadyl Vet. 20 mg tyggetabletter, Rimadyl Vet. 50 mg tyggetabletter, Rimadyl cattle 50 mg/ml oplossing voor injectie, Rimadyl injectievloeistof, 50 mg/ml voor honden en katten, Rimadyl smakelijke tabletten 100 mg voor honden, Rimadyl smakelijke tabletten 20 mg voor honden, Rimadyl smakelijke tabletten 50 mg voor honden, Rimadyl vet. 100 mg Tuggtablett, Rimadyl vet. 100 mg tyggetabletter, Rimadyl vet. 20 mg Tuggtablett, Rimadyl vet. 20 mg tyggetabletter, Rimadyl vet. 50 mg Tuggtablett, Rimadyl vet. 50 mg tyggetabletter, Rimadyl vet., 100 mg, Tuggtablett, Rimadyl Μασώμενο Δισκίο 100mg για σκύλους, Rimadyl Μασώμενο Δισκίο 20mg για σκύλους, Rimadyl Μασώμενο Δισκίο 50mg για σκύλους, Rimadyl, 100 mg närimistablett koertele, Rimadyl, 20 mg närimistablett koertele, Rimadyl, 50 mg närimistablett koertele, Rimadyl,","Dehydration, Elevated blood urea nitrogen (BUN), Elevated creatinine, Elevated symmetrical dimethylarginine (SDMA), Fluid in abdomen NOS, Hyperkalaemia, Hyperphosphataemia, Hypothermia, Lethargy (see also Central nervous system depression in Neurological), Leucocytosis NOS, Not drinking, Not eating, Pyloric ulcer, Tense abdomen",1,1,
USA-BIAHPV1P-23US018858,"<a target=""_blank""  href=""/xmlpserver/EVVET3 PW NEW/Subject Area Contents/Public Website/Report (PDF)/AER.xdo?_xpf=&_xpt=1&_params%2FOracle%20BI%20EE%3A%3ADefaultApp%3A%3AEVVET3%20PR%20NEW%2FAER%3A%3Adimension%2FAER%20Id%3A%3Aattribute%3A%3Anoaggr%3A%3Axsd%3Adouble=20000183732&_xt=AER&_xf=pdf""> AER </a>",2023-06-13 00:00:00,Veterinarian,United States,FEMALE,Dog,Retriever - Labrador,Previcox 227 mg - Chewable tablet,Lack of efficacy - NOS,1,1,
USA-BIAHPV1P-23US019135,"<a target=""_blank""  href=""/xmlpserver/EVVET3 PW NEW/Subject Area Contents/Public Website/Report (PDF)/AER.xdo?_xpf=&_xpt=1&_params%2FOracle%20BI%20EE%3A%3ADefaultApp%3A%3AEVVET3%20PR%20NEW%2FAER%3A%3Adimension%2FAER%20Id%3A%3Aattribute%3A%3Anoaggr%3A%3Axsd%3Adouble=20000186038&_xt=AER&_xf=pdf""> AER </a>",2023-06-15 00:00:00,Veterinarian,United States,MALE,Dog,Shih Tzu,Previcox 57 mg - Chewable tablet,"Circling - behavioural disorder (see also Neurological disorders), Death by euthanasia, Dyspnoea, Elevated blood urea nitrogen (BUN), Elevated creatinine, Hyperkalaemia, Hypoproteinaemia, Not eating, Pleural effusion",1,1,1
USA-BIAHPV1P-23US023878,"<a target=""_blank""  href=""/xmlpserver/EVVET3 PW NEW/Subject Area Contents/Public Website/Report (PDF)/AER.xdo?_xpf=&_xpt=1&_params%2FOracle%20BI%20EE%3A%3ADefaultApp%3A%3AEVVET3%20PR%20NEW%2FAER%3A%3Adimension%2FAER%20Id%3A%3Aattribute%3A%3Anoaggr%3A%3Axsd%3Adouble=20000201235&_xt=AER&_xf=pdf""> AER </a>",2023-07-13 00:00:00,Veterinarian,United States,UNKNOWN,Dog,Dog (unknown),Previcox 227 mg - Chewable tablet,Vomiting,2,2,
