Case number,AER form,Received date,Reporter,Country,Gender,Species,Breed,Drug,Reaction,Animals affected,Animals treated,Animals died
AND-BIAHPV1P-23AD000002,"<a target=""_blank""  href=""/xmlpserver/EVVET3 PW NEW/Subject Area Contents/Public Website/Report (PDF)/AER.xdo?_xpf=&_xpt=1&_params%2FOracle%20BI%20EE%3A%3ADefaultApp%3A%3AEVVET3%20PR%20NEW%2FAER%3A%3Adimension%2FAER%20Id%3A%3Aattribute%3A%3Anoaggr%3A%3Axsd%3Adouble=20000233718&_xt=AER&_xf=pdf""> AER </a>",2023-09-16 00:00:00,Veterinarian,Andorra,UNKNOWN,Dog,Dog (other),Previcox 57 mg - Chewable tablet,"Sickness, Vomiting",1,1,
AUS-BIAHPV1P-23AU000045,"<a target=""_blank""  href=""/xmlpserver/EVVET3 PW NEW/Subject Area Contents/Public Website/Report (PDF)/AER.xdo?_xpf=&_xpt=1&_params%2FOracle%20BI%20EE%3A%3ADefaultApp%3A%3AEVVET3%20PR%20NEW%2FAER%3A%3Adimension%2FAER%20Id%3A%3Aattribute%3A%3Anoaggr%3A%3Axsd%3Adouble=20000117204&_xt=AER&_xf=pdf""> AER </a>",2023-01-18 00:00:00,Veterinarian,Australia,FEMALE,Dog,"Poodle - Miniature, Spaniel - King Charles Cavalier",Previcox 57 mg - Chewable tablet,"Diarrhoea, Inappetence",1,1,
AUS-BIAHPV1P-23AU000110,"<a target=""_blank""  href=""/xmlpserver/EVVET3 PW NEW/Subject Area Contents/Public Website/Report (PDF)/AER.xdo?_xpf=&_xpt=1&_params%2FOracle%20BI%20EE%3A%3ADefaultApp%3A%3AEVVET3%20PR%20NEW%2FAER%3A%3Adimension%2FAER%20Id%3A%3Aattribute%3A%3Anoaggr%3A%3Axsd%3Adouble=20000144448&_xt=AER&_xf=pdf""> AER </a>",2023-03-29 00:00:00,Unknown,Australia,UNKNOWN,Dog,Collie - Border,Previcox 227 mg - Chewable tablet,"Anorexia, Collapse NOS (see also Cardio-vascular and Neurological disorders), Death by euthanasia, Diarrhoea, Haemorrhage NOS, Shock",1,1,1
AUS-BIAHPV1P-23AU000122,"<a target=""_blank""  href=""/xmlpserver/EVVET3 PW NEW/Subject Area Contents/Public Website/Report (PDF)/AER.xdo?_xpf=&_xpt=1&_params%2FOracle%20BI%20EE%3A%3ADefaultApp%3A%3AEVVET3%20PR%20NEW%2FAER%3A%3Adimension%2FAER%20Id%3A%3Aattribute%3A%3Anoaggr%3A%3Axsd%3Adouble=20000126780&_xt=AER&_xf=pdf""> AER </a>",2023-02-13 00:00:00,Veterinarian,Australia,MALE,Dog,Terrier - Silky,Previcox 57 mg - Chewable tablet,"Abnormal radiograph finding, Cough, Increased lung sounds, Lethargy (see also Central nervous system depression in Neurological), Nasal discharge",1,1,
AUS-BIAHPV1P-23AU000401,"<a target=""_blank""  href=""/xmlpserver/EVVET3 PW NEW/Subject Area Contents/Public Website/Report (PDF)/AER.xdo?_xpf=&_xpt=1&_params%2FOracle%20BI%20EE%3A%3ADefaultApp%3A%3AEVVET3%20PR%20NEW%2FAER%3A%3Adimension%2FAER%20Id%3A%3Aattribute%3A%3Anoaggr%3A%3Axsd%3Adouble=20000167401&_xt=AER&_xf=pdf""> AER </a>",2023-05-12 00:00:00,Veterinarian,Australia,MALE,Dog,Collie - Border,"ACEPROMAZINE 10%/AGROSEED CANDILIDIS ενέσιμο διάλυμα 10 mg/ml για σκύλο και γάτα, Ketamin 10 % šķīdums injekcijām suņiem un kaķiem, Ketamin 10%, Ketamin 100 mg/ml, Ketamine 10% oplossing voor injectie voor honden en katten, Ketamine 10% pro inj., oplossing voor injectie voor honden en katten, Ketamine 10% šķīdums injekcijām suņiem un kaķiem, Ketamine 10%, oplossing voor injectie voor honden en katten, Previcox 227 mg - Chewable tablet, КЕТАМИН 10 %","Abdominal effusion, Acute renal failure, Anuria, Cellulitis, Death by euthanasia, Depression, Dyspnoea, Elevated blood urea nitrogen (BUN), Elevated creatinine, Elevated haematocrit, Elevated symmetrical dimethylarginine (SDMA), Enlarged kidney(s), Hyperaemic mucous membrane, Hyperkalaemia, Hypertension, Hyponatremia, Inappetence, Isosthenuria, Neutrophilia, Prolonged capillary refill time, Vomiting",1,1,1
AUS-BIAHPV1P-23AU000535,"<a target=""_blank""  href=""/xmlpserver/EVVET3 PW NEW/Subject Area Contents/Public Website/Report (PDF)/AER.xdo?_xpf=&_xpt=1&_params%2FOracle%20BI%20EE%3A%3ADefaultApp%3A%3AEVVET3%20PR%20NEW%2FAER%3A%3Adimension%2FAER%20Id%3A%3Aattribute%3A%3Anoaggr%3A%3Axsd%3Adouble=20000195312&_xt=AER&_xf=pdf""> AER </a>",2023-07-03 00:00:00,Veterinarian,Australia,MALE,Dog,Hound - Basset,"ALFAXAN 10 mg/ml solution for injection for dogs and cats, BAYTRIL 0,5% W/V ΠΟΣΙΜΟ ΔΙΑΛΥΜΑ, BAYTRIL 0,5% πόσιμο διάλυμα ενροφλοξακίνης για ορνίθια και γαλοπούλες, BAYTRIL 10 % SOLUTION BUVABLE, BAYTRIL 10 % SOLUTION INJECTABLE, BAYTRIL 10% W/V ΠΟΣΙΜΟ ΔΙΑΛΥΜΑ, BAYTRIL 100 mg/ml - soluţie orală, BAYTRIL 100 mg/ml SOLUCION INYECTABLE, BAYTRIL 100 mg/ml soluție injectabilă, BAYTRIL 150MG/TAB ΔΙΣΚΙΟ, BAYTRIL 15MG/TAB ΔΙΣΚΙΟ, BAYTRIL 2,5 % SOLUTION BUVABLE, BAYTRIL 2,5 % SOLUTION INJECTABLE, BAYTRIL 2,5% W/V ΕΝΕΣΙΜΟ ΔΙΑΛΥΜΑ, BAYTRIL 2,5% W/V ΠΟΣΙΜΟ ΔΙΑΛΥΜΑ, BAYTRIL 25 mg/ml SOLUCION INYECTABLE, BAYTRIL 25 mg/ml SOLUCION ORAL, BAYTRIL 5 % SOLUTION INJECTABLE, BAYTRIL 5 mg/ml SOLUCION ORAL, BAYTRIL 50 mg/ml SOLUCION INYECTABLE, BAYTRIL 50MG/TAB ΔΙΣΚΙΟ, BAYTRIL 50mg/ml ενέσιμο διάλυμα, BAYTRIL, 25mg/ml, Injekční roztok, BAYTRIL, 5% ενέσιμο διάλυμα για μόσχους, χοίρους, πρόβατα, αίγες, σκύλους και γάτες, BAYTRIL, 50mg/ml, Injekční roztok, Baytril  100 mg/ml Oplossing voor injectie, Baytril  100 mg/ml Solution injectable, Baytril - Das Original - 100 mg/ml Injektionslösung, Baytril - Das Original - 25 mg/ml Injektionslösung, Baytril - Das Original - 50 mg/ml Injektionslösung, Baytril 0,5 % solução oral para leitões, Baytril 0,5%, Baytril 10 % solução oral, Baytril 10%, Baytril 10% O.L., Baytril 10% Oral Solution, Baytril 100 mg/mL, otopina za injekciju, za goveda, ovce, koze i svinje, Baytril 100 mg/mL, otopina za primjenu u vodi za piće, za kokoši, purane i kuniće, Baytril 100 mg/ml - Injektionslösung für Tiere, Baytril 100 mg/ml - Lösung zum Eingeben für Hühner, Puten und Kaninchen, Baytril 100 mg/ml Oplossing voor gebruik in drinkwater, Baytril 100 mg/ml Solution buvable, Baytril 100 mg/ml Solution for Injection, Baytril 100 mg/ml koncentrat za peroralno raztopino za piščance, purane in kunce, Baytril 100 mg/ml oldat ivóvízbe keveréshez A.U.V., Baytril 100 mg/ml oplossing voor gebruik in drinkwater voor kippen, kalkoenen en konijnen, Baytril 100 mg/ml oplossing voor injectie, Baytril 100 mg/ml raztopina za injiciranje, Baytril 100 mg/ml solution for injection, Baytril 100 mg/ml soluzione iniettabile, Baytril 100 mg/ml solução injetável, Baytril 150 mg tabletta A.U.V., Baytril 2,5%, 25 mg/mL, otopina za injekciju za pse, mačke, prasad, kuniće, glodavce, gmazove i ukrasne ptice, Baytril 2.5% Oral Solution, Baytril 25 mg/ml - Injektionslösung für Tiere, Baytril 25 mg/ml - Lösung zum Eingeben für Kälber und Lämmer, Baytril 25 mg/ml Lösung zum Eingeben für Rinder (Kälber), Baytril 25 mg/ml Oplossing voor injectie, Baytril 25 mg/ml Solution injectable, Baytril 25 mg/ml injekčný roztok, Baytril 25 mg/ml oldatos injekció A.U.V., Baytril 25 mg/ml oplossing voor injectie, Baytril 25 mg/ml roztwór do wstrzykiwań, Baytril 25 mg/ml solution for injection, Baytril 25 mg/ml soluzione iniettabile, Baytril 25 mg/ml soluzione iniettabile per cani, gatti, roditori e conigli da compagnia, rettili e uccelli ornamentali, Baytril 25 mg/ml soluzione orale per vitelli, ovini, caprini, suini, Baytril 25 mg/ml solução injetável, Baytril 5 mg/ml - Lösung zum Eingeben für Schweine, Baytril 5 mg/ml belsőleges oldat sertések részére A.U.V., Baytril 50 mg tabletta A.U.V., Baytril 50 mg/mL, otopina za injekciju, za telad, ovce, koze, svinje, pse i mačke, Baytril 50 mg/ml - Injektionslösung für Tiere, Baytril 50 mg/ml Oplossing voor injectie, Baytril 50 mg/ml Solution for Injection, Baytril 50 mg/ml Solution injectable, Baytril 50 mg/ml injekčný roztok, Baytril 50 mg/ml oldatos injekció A.U.V., Baytril 50 mg/ml oplossing voor injectie, Baytril 50 mg/ml raztopina za injiciranje, Baytril 50 mg/ml soluzione iniettabile, Baytril 50 mg/ml solução injetável, Baytril 50 mg/ml soluție injectabilă, Baytril Direct 100 mg/ml Injektionslösung für Rinder und Schweine, Baytril Piglet Doser 0.5% Oral Solution, Baytril Vet. 100 mg/ml injektionsvæske, opløsning, Baytril Vet. 150 mg tabletter, Baytril Vet. 25 mg/ml oral opløsning, Baytril Vet. 50 mg tabletter, Baytril Vet. 50 mg/ml inj","Abdominal pain, Abdominal transudate, Abnormal ultrasound finding, Cyanosis, Death, Hypothermia, Inappetence, Increased respiratory rate, Intestinal congestion, Intestinal disorder NOS, Intestinal perforation, Lethargy (see also Central nervous system depression in Neurological), Malaise, Moribund, Neutrophilia, Pacing, Pale mucous membrane, Reduced faecal output, Tenesmus, Vomiting",1,1,1
AUS-BIAHPV1P-23AU000537,"<a target=""_blank""  href=""/xmlpserver/EVVET3 PW NEW/Subject Area Contents/Public Website/Report (PDF)/AER.xdo?_xpf=&_xpt=1&_params%2FOracle%20BI%20EE%3A%3ADefaultApp%3A%3AEVVET3%20PR%20NEW%2FAER%3A%3Adimension%2FAER%20Id%3A%3Aattribute%3A%3Anoaggr%3A%3Axsd%3Adouble=20000192528&_xt=AER&_xf=pdf""> AER </a>",2023-06-28 00:00:00,Veterinarian,Australia,MALE,Dog,"Dog (other), Dog (unknown)",Previcox 227 mg - Chewable tablet,"Collapse (see also Cardio-vascular and Systemic disorders), Elevated liver enzymes NOS, Leucocytosis NOS, Neutrophilia, Vomiting",1,1,
AUS-BIAHPV1P-23AU000548,"<a target=""_blank""  href=""/xmlpserver/EVVET3 PW NEW/Subject Area Contents/Public Website/Report (PDF)/AER.xdo?_xpf=&_xpt=1&_params%2FOracle%20BI%20EE%3A%3ADefaultApp%3A%3AEVVET3%20PR%20NEW%2FAER%3A%3Adimension%2FAER%20Id%3A%3Aattribute%3A%3Anoaggr%3A%3Axsd%3Adouble=20000185515&_xt=AER&_xf=pdf""> AER </a>",2023-06-15 00:00:00,Other health care professional,Australia,UNKNOWN,Dog,Terrier - Bull - Staffordshire,Previcox 227 mg - Chewable tablet,Elevated symmetrical dimethylarginine (SDMA),1,1,
AUS-BIAHPV1P-23AU000705,"<a target=""_blank""  href=""/xmlpserver/EVVET3 PW NEW/Subject Area Contents/Public Website/Report (PDF)/AER.xdo?_xpf=&_xpt=1&_params%2FOracle%20BI%20EE%3A%3ADefaultApp%3A%3AEVVET3%20PR%20NEW%2FAER%3A%3Adimension%2FAER%20Id%3A%3Aattribute%3A%3Anoaggr%3A%3Axsd%3Adouble=20000216997&_xt=AER&_xf=pdf""> AER </a>",2023-08-14 00:00:00,Animal owner,Australia,MALE,Dog,"Terrier - Fox (unspecified), Terrier - Jack Russell","NexGard 28.3 mg - Chewable tablet, Previcox 57 mg - Chewable tablet",Vomiting,1,1,
AUS-BIAHPV1P-23AU000740,"<a target=""_blank""  href=""/xmlpserver/EVVET3 PW NEW/Subject Area Contents/Public Website/Report (PDF)/AER.xdo?_xpf=&_xpt=1&_params%2FOracle%20BI%20EE%3A%3ADefaultApp%3A%3AEVVET3%20PR%20NEW%2FAER%3A%3Adimension%2FAER%20Id%3A%3Aattribute%3A%3Anoaggr%3A%3Axsd%3Adouble=20000216990&_xt=AER&_xf=pdf""> AER </a>",2023-08-14 00:00:00,Animal owner,Australia,MALE,Dog,"Terrier - Fox (unspecified), Terrier - Jack Russell","NexGard 28.3 mg - Chewable tablet, Previcox 57 mg - Chewable tablet",Not himself/herself,1,1,
AUS-BIAHPV1P-23AU000856,"<a target=""_blank""  href=""/xmlpserver/EVVET3 PW NEW/Subject Area Contents/Public Website/Report (PDF)/AER.xdo?_xpf=&_xpt=1&_params%2FOracle%20BI%20EE%3A%3ADefaultApp%3A%3AEVVET3%20PR%20NEW%2FAER%3A%3Adimension%2FAER%20Id%3A%3Aattribute%3A%3Anoaggr%3A%3Axsd%3Adouble=20000265951&_xt=AER&_xf=pdf""> AER </a>",2023-11-15 00:00:00,Other,Australia,FEMALE,Dog,Spaniel - Springer Welsh,"Amoxiclav 200/50 mg Tabletten für Hunde, Amoxiclav 200/50 mg tabletta kutyák és macskák részére A.U.V., Amoxiclav 40/10 mg, Amoxiclav 40/10 mg tabletta kutyák és macskák részére A.U.V., Amoxiclav 400/100 mg, Amoxiclav 400/100 mg tabletta kutyák részére A.U.V., Dexamethasone 2 mg/mL, Dexamethasone 2 mg/ml, Dexamethasone 2 mg/ml 2 mg/ml šķīdums injekcijām zirgiem, liellopiem, aitām, kazām, cūkām, suņiem un kaķiem, Dexamethasone 2 mg/ml solution for injection for dogs, cats, cattle and horses, Dexamethasone pro inj, 2 mg/ml oplossing voor injectie voor honden en katten, Neptra 16.7 mg/ml florfenicol + 16.7 mg/ml terbinafine hydrochloride + 2.2 mg/ml mometasone furoate - Ear drops, solution in single-dose container, Previcox 227 mg - Chewable tablet, ДЕКСАМЕТАЗОН 2 mg/ml инжекционен разтвор, ПИРОКАРПИН 5 % разтвор за инжекции","Abnormal menace reflex test, Abnormal pupil light reflex, Abnormal vision (see also impaired vision), Aggression, Anxiety, Ataxia, Blindness, Circling - neurological disorder (see also Behavioural disorders), Collapse of leg, Conjunctival reddening, Diarrhoea, Difficulty standing, Dilated pupils, Dry eye, Dry nose, Dullness, Dysphagia, Eructation, Facial paralysis, Faecal impaction, Head tilt - neurological disorder (see also Head tilt - ear disorder), Head tremor, Horizontal nystagmus, Lethargy (see also Central nervous system depression in Neurological), Malaise, Mydriasis, Neck pain - neurological, Not drinking, Not eating, Not himself/herself, Optic nerve disorder, Pain NOS, Panting, Partial blindness, Pharyngeal disorder, Pica NOS, Restlessness, Seizure NOS, Tachycardia, Tachypnoea, Tongue disorder NOS",1,1,
AUS-BIAHPV1P-23AU001084,"<a target=""_blank""  href=""/xmlpserver/EVVET3 PW NEW/Subject Area Contents/Public Website/Report (PDF)/AER.xdo?_xpf=&_xpt=1&_params%2FOracle%20BI%20EE%3A%3ADefaultApp%3A%3AEVVET3%20PR%20NEW%2FAER%3A%3Adimension%2FAER%20Id%3A%3Aattribute%3A%3Anoaggr%3A%3Axsd%3Adouble=20000265616&_xt=AER&_xf=pdf""> AER </a>",2023-11-15 00:00:00,Veterinarian,Australia,FEMALE,Dog,Collie - Border,"Prednisolone 1% 10 mg/ml Oplossing voor injectie, Prednisolone 2,5% suspensie voor injectie voor honden, Prednisolone 2.5 % Oplossing voor injectie, Previcox 227 mg - Chewable tablet","Acidosis, Agglutination test, positive, Dehydration, Direct Coombs test, positive, Dry mucous membrane, Elevated C-reactive protein, Elevated mean corpuscular volume (MCV), Hyperkalaemia, Hypernatremia, Immune mediated haemolytic anaemia, Inappetence, Lethargy (see also Central nervous system depression in Neurological), Nausea, Non-regenerative anaemia, Regenerative anaemia, Vomiting bile",1,1,
AUS-BIAHPV1P-23AU001143,"<a target=""_blank""  href=""/xmlpserver/EVVET3 PW NEW/Subject Area Contents/Public Website/Report (PDF)/AER.xdo?_xpf=&_xpt=1&_params%2FOracle%20BI%20EE%3A%3ADefaultApp%3A%3AEVVET3%20PR%20NEW%2FAER%3A%3Adimension%2FAER%20Id%3A%3Aattribute%3A%3Anoaggr%3A%3Axsd%3Adouble=20000270632&_xt=AER&_xf=pdf""> AER </a>",2023-11-23 00:00:00,Animal owner,Australia,FEMALE,Dog,"Retriever - Golden, Retriever - Labrador",Previcox 227 mg - Chewable tablet,"Gastric ulcer, Vomiting",1,1,
AUS-BIAHPV1P-23AU001262,"<a target=""_blank""  href=""/xmlpserver/EVVET3 PW NEW/Subject Area Contents/Public Website/Report (PDF)/AER.xdo?_xpf=&_xpt=1&_params%2FOracle%20BI%20EE%3A%3ADefaultApp%3A%3AEVVET3%20PR%20NEW%2FAER%3A%3Adimension%2FAER%20Id%3A%3Aattribute%3A%3Anoaggr%3A%3Axsd%3Adouble=20000285321&_xt=AER&_xf=pdf""> AER </a>",2023-12-21 00:00:00,Other,Australia,FEMALE,Dog,Retriever - Labrador,"Librela 10 mg - Solution for injection, Librela 15 mg - Solution for injection, Librela 20 mg - Solution for injection, Librela 30 mg - Solution for injection, Librela 5 mg - Solution for injection, Previcox 227 mg - Chewable tablet","Death by euthanasia, Joint swelling, Lameness, Musculoskeletal neoplasm NOS, Urinary incontinence",1,1,1
AUS-BIAHPV1P-23AU001283,"<a target=""_blank""  href=""/xmlpserver/EVVET3 PW NEW/Subject Area Contents/Public Website/Report (PDF)/AER.xdo?_xpf=&_xpt=1&_params%2FOracle%20BI%20EE%3A%3ADefaultApp%3A%3AEVVET3%20PR%20NEW%2FAER%3A%3Adimension%2FAER%20Id%3A%3Aattribute%3A%3Anoaggr%3A%3Axsd%3Adouble=20000278767&_xt=AER&_xf=pdf""> AER </a>",2023-12-11 00:00:00,Animal owner,Australia,MALE,Dog,Maltese,Previcox 57 mg - Chewable tablet,Diarrhoea,1,1,
AUS-ZOETISPV-2023-AU-00364,"<a target=""_blank""  href=""/xmlpserver/EVVET3 PW NEW/Subject Area Contents/Public Website/Report (PDF)/AER.xdo?_xpf=&_xpt=1&_params%2FOracle%20BI%20EE%3A%3ADefaultApp%3A%3AEVVET3%20PR%20NEW%2FAER%3A%3Adimension%2FAER%20Id%3A%3Aattribute%3A%3Anoaggr%3A%3Axsd%3Adouble=20000158799&_xt=AER&_xf=pdf""> AER </a>",2023-04-26 00:00:00,Veterinarian,Australia,MALE,Dog,Poodle - Toy,"Librela 10 mg - Solution for injection, Librela 15 mg - Solution for injection, Librela 20 mg - Solution for injection, Librela 30 mg - Solution for injection, Librela 5 mg - Solution for injection, Previcox 227 mg - Chewable tablet, Previcox 57 mg - Chewable tablet","Alopecia local, Dry skin",1,1,
AUS-ZOETISPV-2023-AU-00392,"<a target=""_blank""  href=""/xmlpserver/EVVET3 PW NEW/Subject Area Contents/Public Website/Report (PDF)/AER.xdo?_xpf=&_xpt=1&_params%2FOracle%20BI%20EE%3A%3ADefaultApp%3A%3AEVVET3%20PR%20NEW%2FAER%3A%3Adimension%2FAER%20Id%3A%3Aattribute%3A%3Anoaggr%3A%3Axsd%3Adouble=20000206339&_xt=AER&_xf=pdf""> AER </a>",2023-07-25 00:00:00,Veterinarian,Australia,MALE,Dog,Bulldog - American,"Librela 10 mg - Solution for injection, Librela 15 mg - Solution for injection, Librela 20 mg - Solution for injection, Librela 30 mg - Solution for injection, Librela 5 mg - Solution for injection, Previcox 227 mg - Chewable tablet, Previcox 57 mg - Chewable tablet, Previcox 8.2 mg/g - Oral paste","Abnormal red blood cell, Anaemia NOS, Cholelithiasis, Collapse NOS (see also Cardio-vascular and Neurological disorders), Decreased cholesterol (total), Decreased haematocrit, Depression, Diarrhoea, Dry mucous membrane, Elevated amylase, Enlarged lymph node (localised), Fatigue, Gut sounds increased, Hyperkalaemia, Hypoproteinaemia, Joint effusion, Joint inflammation, Joint pain, Leucocytosis NOS, Limping, Localised oedema (not application site), Lymphoplasmacytic enteritis, Melaena, Myopathy, Neutrophilia, Oedema of the extremities (see also other SOCs for most applicable oedema), Pallor, Prostate hyperplasia, Renal infarcts, Splenomegaly, Stiffness limb, Swollen joint, Swollen limb, Tachycardia, Tachypnoea, Thrombocytosis, Unable to rise, Vocalisation, Warm feeling to the touch, Weak pulse, Weight loss",1,1,
AUS-ZOETISPV-2023-AU-00565,"<a target=""_blank""  href=""/xmlpserver/EVVET3 PW NEW/Subject Area Contents/Public Website/Report (PDF)/AER.xdo?_xpf=&_xpt=1&_params%2FOracle%20BI%20EE%3A%3ADefaultApp%3A%3AEVVET3%20PR%20NEW%2FAER%3A%3Adimension%2FAER%20Id%3A%3Aattribute%3A%3Anoaggr%3A%3Axsd%3Adouble=20000245964&_xt=AER&_xf=pdf""> AER </a>",2023-10-09 00:00:00,Veterinarian,Australia,MALE,Dog,"Cattle Dog - Australian (blue heeler, red heeler, Queensland cattledog)","Librela 10 mg - Solution for injection, Librela 15 mg - Solution for injection, Librela 20 mg - Solution for injection, Librela 30 mg - Solution for injection, Librela 5 mg - Solution for injection, Previcox 227 mg - Chewable tablet, Previcox 57 mg - Chewable tablet, Previcox 8.2 mg/g - Oral paste","Head tilt - neurological disorder (see also Head tilt - ear disorder), Horizontal nystagmus, Panting, Stumbling gait",1,1,
AUS-ZOETISPV-2023-AU-00567,"<a target=""_blank""  href=""/xmlpserver/EVVET3 PW NEW/Subject Area Contents/Public Website/Report (PDF)/AER.xdo?_xpf=&_xpt=1&_params%2FOracle%20BI%20EE%3A%3ADefaultApp%3A%3AEVVET3%20PR%20NEW%2FAER%3A%3Adimension%2FAER%20Id%3A%3Aattribute%3A%3Anoaggr%3A%3Axsd%3Adouble=20000179282&_xt=AER&_xf=pdf""> AER </a>",2023-06-05 00:00:00,Veterinarian,Australia,FEMALE,Dog,"Poodle (unspecified), Spaniel - King Charles Cavalier","Librela 10 mg - Solution for injection, Librela 15 mg - Solution for injection, Librela 20 mg - Solution for injection, Librela 30 mg - Solution for injection, Librela 5 mg - Solution for injection, Previcox 227 mg - Chewable tablet, Previcox 57 mg - Chewable tablet, Previcox 8.2 mg/g - Oral paste",Emesis (multiple),1,1,
AUS-ZOETISPV-2023-AU-00672,"<a target=""_blank""  href=""/xmlpserver/EVVET3 PW NEW/Subject Area Contents/Public Website/Report (PDF)/AER.xdo?_xpf=&_xpt=1&_params%2FOracle%20BI%20EE%3A%3ADefaultApp%3A%3AEVVET3%20PR%20NEW%2FAER%3A%3Adimension%2FAER%20Id%3A%3Aattribute%3A%3Anoaggr%3A%3Axsd%3Adouble=20000189230&_xt=AER&_xf=pdf""> AER </a>",2023-06-22 00:00:00,Veterinarian,Australia,FEMALE,Dog,Spaniel - Springer English,"Librela 10 mg - Solution for injection, Librela 15 mg - Solution for injection, Librela 20 mg - Solution for injection, Librela 30 mg - Solution for injection, Librela 5 mg - Solution for injection, Previcox 227 mg - Chewable tablet, Previcox 57 mg - Chewable tablet, Previcox 8.2 mg/g - Oral paste","Diarrhoea, Inappetence",1,1,
AUS-ZOETISPV-2023-AU-00798,"<a target=""_blank""  href=""/xmlpserver/EVVET3 PW NEW/Subject Area Contents/Public Website/Report (PDF)/AER.xdo?_xpf=&_xpt=1&_params%2FOracle%20BI%20EE%3A%3ADefaultApp%3A%3AEVVET3%20PR%20NEW%2FAER%3A%3Adimension%2FAER%20Id%3A%3Aattribute%3A%3Anoaggr%3A%3Axsd%3Adouble=20000214572&_xt=AER&_xf=pdf""> AER </a>",2023-08-09 00:00:00,Veterinarian,Australia,FEMALE,Dog,Retriever - Labrador,"Librela 10 mg - Solution for injection, Librela 15 mg - Solution for injection, Librela 20 mg - Solution for injection, Librela 30 mg - Solution for injection, Librela 5 mg - Solution for injection, Previcox 227 mg - Chewable tablet, Previcox 57 mg - Chewable tablet",Lack of efficacy - NOS,1,1,
AUS-ZOETISPV-2023-AU-00950,"<a target=""_blank""  href=""/xmlpserver/EVVET3 PW NEW/Subject Area Contents/Public Website/Report (PDF)/AER.xdo?_xpf=&_xpt=1&_params%2FOracle%20BI%20EE%3A%3ADefaultApp%3A%3AEVVET3%20PR%20NEW%2FAER%3A%3Adimension%2FAER%20Id%3A%3Aattribute%3A%3Anoaggr%3A%3Axsd%3Adouble=20000210135&_xt=AER&_xf=pdf""> AER </a>",2023-08-01 00:00:00,Veterinarian,Australia,MALE,Dog,Terrier - Jack Russell,"Librela 10 mg - Solution for injection, Librela 15 mg - Solution for injection, Librela 20 mg - Solution for injection, Librela 30 mg - Solution for injection, Librela 5 mg - Solution for injection, Previcox 227 mg - Chewable tablet, Previcox 57 mg - Chewable tablet, Previcox 8.2 mg/g - Oral paste","Lethargy (see also Central nervous system depression in Neurological), Partial lack of efficacy",1,1,
AUS-ZOETISPV-2023-AU-01041,"<a target=""_blank""  href=""/xmlpserver/EVVET3 PW NEW/Subject Area Contents/Public Website/Report (PDF)/AER.xdo?_xpf=&_xpt=1&_params%2FOracle%20BI%20EE%3A%3ADefaultApp%3A%3AEVVET3%20PR%20NEW%2FAER%3A%3Adimension%2FAER%20Id%3A%3Aattribute%3A%3Anoaggr%3A%3Axsd%3Adouble=20000213760&_xt=AER&_xf=pdf""> AER </a>",2023-08-08 00:00:00,Veterinarian,Australia,FEMALE,Dog,Collie - Border,"Librela 10 mg - Solution for injection, Librela 15 mg - Solution for injection, Librela 20 mg - Solution for injection, Librela 30 mg - Solution for injection, Librela 5 mg - Solution for injection, Previcox 227 mg - Chewable tablet, Previcox 57 mg - Chewable tablet, Previcox 8.2 mg/g - Oral paste",Fracture,1,1,
AUS-ZOETISPV-2023-AU-01042,"<a target=""_blank""  href=""/xmlpserver/EVVET3 PW NEW/Subject Area Contents/Public Website/Report (PDF)/AER.xdo?_xpf=&_xpt=1&_params%2FOracle%20BI%20EE%3A%3ADefaultApp%3A%3AEVVET3%20PR%20NEW%2FAER%3A%3Adimension%2FAER%20Id%3A%3Aattribute%3A%3Anoaggr%3A%3Axsd%3Adouble=20000211407&_xt=AER&_xf=pdf""> AER </a>",2023-08-03 00:00:00,Veterinarian,Australia,FEMALE,Dog,Collie - Border,"Librela 10 mg - Solution for injection, Librela 15 mg - Solution for injection, Librela 20 mg - Solution for injection, Librela 30 mg - Solution for injection, Librela 5 mg - Solution for injection, Previcox 227 mg - Chewable tablet, Previcox 57 mg - Chewable tablet, Previcox 8.2 mg/g - Oral paste",Partial lack of efficacy,1,1,
AUS-ZOETISPV-2023-AU-01043,"<a target=""_blank""  href=""/xmlpserver/EVVET3 PW NEW/Subject Area Contents/Public Website/Report (PDF)/AER.xdo?_xpf=&_xpt=1&_params%2FOracle%20BI%20EE%3A%3ADefaultApp%3A%3AEVVET3%20PR%20NEW%2FAER%3A%3Adimension%2FAER%20Id%3A%3Aattribute%3A%3Anoaggr%3A%3Axsd%3Adouble=20000216444&_xt=AER&_xf=pdf""> AER </a>",2023-08-14 00:00:00,Veterinarian,Australia,FEMALE,Dog,Dog (other),"Librela 10 mg - Solution for injection, Librela 15 mg - Solution for injection, Librela 20 mg - Solution for injection, Librela 30 mg - Solution for injection, Librela 5 mg - Solution for injection, Previcox 227 mg - Chewable tablet, Previcox 57 mg - Chewable tablet, Previcox 8.2 mg/g - Oral paste","Collapse NOS (see also Cardio-vascular and Neurological disorders), Death by euthanasia, Inappetence, Inappropriate urination, Lethargy (see also Central nervous system depression in Neurological), Other abnormal test result NOS, Renal failure, Restlessness, Wobbliness",1,1,1
AUS-ZOETISPV-2023-AU-01285,"<a target=""_blank""  href=""/xmlpserver/EVVET3 PW NEW/Subject Area Contents/Public Website/Report (PDF)/AER.xdo?_xpf=&_xpt=1&_params%2FOracle%20BI%20EE%3A%3ADefaultApp%3A%3AEVVET3%20PR%20NEW%2FAER%3A%3Adimension%2FAER%20Id%3A%3Aattribute%3A%3Anoaggr%3A%3Axsd%3Adouble=20000240803&_xt=AER&_xf=pdf""> AER </a>",2023-09-28 00:00:00,Veterinarian,Australia,MALE,Dog,Dogue de Bordeaux,"Librela 10 mg - Solution for injection, Librela 15 mg - Solution for injection, Librela 20 mg - Solution for injection, Librela 30 mg - Solution for injection, Librela 5 mg - Solution for injection, Previcox 227 mg - Chewable tablet, Previcox 57 mg - Chewable tablet","Skin lesion NOS, Swollen limb",1,1,
AUS-ZOETISPV-2023-AU-01299,"<a target=""_blank""  href=""/xmlpserver/EVVET3 PW NEW/Subject Area Contents/Public Website/Report (PDF)/AER.xdo?_xpf=&_xpt=1&_params%2FOracle%20BI%20EE%3A%3ADefaultApp%3A%3AEVVET3%20PR%20NEW%2FAER%3A%3Adimension%2FAER%20Id%3A%3Aattribute%3A%3Anoaggr%3A%3Axsd%3Adouble=20000230740&_xt=AER&_xf=pdf""> AER </a>",2023-09-11 00:00:00,Veterinarian,Australia,MALE,Dog,Dogue de Bordeaux,"Librela 10 mg - Solution for injection, Librela 15 mg - Solution for injection, Librela 20 mg - Solution for injection, Librela 30 mg - Solution for injection, Librela 5 mg - Solution for injection, Previcox 227 mg - Chewable tablet, Previcox 57 mg - Chewable tablet",Haematoma NOS,1,1,
