Case number,AER form,Received date,Reporter,Country,Gender,Species,Breed,Drug,Reaction,Animals affected,Animals treated,Animals died
GBR-BIAHPV1P-23UK002773,"<a target=""_blank""  href=""/xmlpserver/EVVET3 PW NEW/Subject Area Contents/Public Website/Report (PDF)/AER.xdo?_xpf=&_xpt=1&_params%2FOracle%20BI%20EE%3A%3ADefaultApp%3A%3AEVVET3%20PR%20NEW%2FAER%3A%3Adimension%2FAER%20Id%3A%3Aattribute%3A%3Anoaggr%3A%3Axsd%3Adouble=20000285385&_xt=AER&_xf=pdf""> AER </a>",2023-12-21 00:00:00,Veterinarian,United Kingdom,MALE,Dog,Retriever - Labrador,Previcox 227 mg - Chewable tablet,"Lethargy (see also Central nervous system depression in Neurological), Sedation, Tonic-clonic seizure",1,1,
GBR-DECHRALT-2022-11309,"<a target=""_blank""  href=""/xmlpserver/EVVET3 PW NEW/Subject Area Contents/Public Website/Report (PDF)/AER.xdo?_xpf=&_xpt=1&_params%2FOracle%20BI%20EE%3A%3ADefaultApp%3A%3AEVVET3%20PR%20NEW%2FAER%3A%3Adimension%2FAER%20Id%3A%3Aattribute%3A%3Anoaggr%3A%3Axsd%3Adouble=20000135141&_xt=AER&_xf=pdf""> AER </a>",2023-03-03 00:00:00,Veterinarian,United Kingdom,MALE,Dog,Crossbred Canine/dog,"Apoquel 16 mg - Chewable tablet, Apoquel 16 mg - Film-coated tablet, Apoquel 3.6 mg - Chewable tablet, Apoquel 3.6 mg - Film-coated tablet, Apoquel 5.4 mg - Chewable tablet, Apoquel 5.4 mg - Film-coated tablet, Previcox 227 mg - Chewable tablet, Previcox 57 mg - Chewable tablet, Previcox 8.2 mg/g - Oral paste","Decreased haemoglobin, Elevated alanine aminotransferase (ALT), Elevated mean corpuscular volume (MCV), Hyperkalaemia, Hypocortisolaemia, Low sodium-potassium ratio (Na:K ratio), Other abnormal test result NOS, Panting, Stiffness limb",1,1,
GBR-DECHRALT-2023-10972,"<a target=""_blank""  href=""/xmlpserver/EVVET3 PW NEW/Subject Area Contents/Public Website/Report (PDF)/AER.xdo?_xpf=&_xpt=1&_params%2FOracle%20BI%20EE%3A%3ADefaultApp%3A%3AEVVET3%20PR%20NEW%2FAER%3A%3Adimension%2FAER%20Id%3A%3Aattribute%3A%3Anoaggr%3A%3Axsd%3Adouble=20000215363&_xt=AER&_xf=pdf""> AER </a>",2023-08-10 00:00:00,Veterinarian,United Kingdom,FEMALE,Dog,Crossbred Canine/dog,"Previcox 227 mg - Chewable tablet, Previcox 57 mg - Chewable tablet, Previcox 8.2 mg/g - Oral paste, Thyforon flavoured 400 microgram tablets for dogs","Collapse NOS (see also Cardio-vascular and Neurological disorders), Elevated renal parameters, Wobbliness",1,1,
GBR-VMDDEFRA-00396/23,"<a target=""_blank""  href=""/xmlpserver/EVVET3 PW NEW/Subject Area Contents/Public Website/Report (PDF)/AER.xdo?_xpf=&_xpt=1&_params%2FOracle%20BI%20EE%3A%3ADefaultApp%3A%3AEVVET3%20PR%20NEW%2FAER%3A%3Adimension%2FAER%20Id%3A%3Aattribute%3A%3Anoaggr%3A%3Axsd%3Adouble=20000139369&_xt=AER&_xf=pdf""> AER </a>",2023-03-15 00:00:00,Veterinarian,United Kingdom,FEMALE,Dog,Crossbred Canine/dog,Previcox 57 mg - Chewable tablet,"Acute renal failure, Dehydration, Inappetence, Lethargy (see also Central nervous system depression in Neurological), Polydipsia, Polyuria",1,1,
GBR-VMDDEFRA-02367/23,"<a target=""_blank""  href=""/xmlpserver/EVVET3 PW NEW/Subject Area Contents/Public Website/Report (PDF)/AER.xdo?_xpf=&_xpt=1&_params%2FOracle%20BI%20EE%3A%3ADefaultApp%3A%3AEVVET3%20PR%20NEW%2FAER%3A%3Adimension%2FAER%20Id%3A%3Aattribute%3A%3Anoaggr%3A%3Axsd%3Adouble=20000275373&_xt=AER&_xf=pdf""> AER </a>",2023-12-04 00:00:00,Veterinarian,United Kingdom,UNKNOWN,Dog,Spaniel - Springer English,Previcox 227 mg - Chewable tablet,Pustules,1,1,
GBR-VTQLPROD-23VTQL00593,"<a target=""_blank""  href=""/xmlpserver/EVVET3 PW NEW/Subject Area Contents/Public Website/Report (PDF)/AER.xdo?_xpf=&_xpt=1&_params%2FOracle%20BI%20EE%3A%3ADefaultApp%3A%3AEVVET3%20PR%20NEW%2FAER%3A%3Adimension%2FAER%20Id%3A%3Aattribute%3A%3Anoaggr%3A%3Axsd%3Adouble=20000154691&_xt=AER&_xf=pdf""> AER </a>",2023-04-17 00:00:00,Veterinarian,United Kingdom,FEMALE,Dog,Retriever - Golden,"Barbivet vet 30 mg tabletti, Barbivet vet 60 mg tabletti, Previcox 227 mg - Chewable tablet","Elevated serum alkaline phosphatase (ALP), Lack of efficacy - NOS, Polydipsia, Polyphagia, Sedation, Vacant",1,1,
GBR-ZOETISPV-2023-UK-00644,"<a target=""_blank""  href=""/xmlpserver/EVVET3 PW NEW/Subject Area Contents/Public Website/Report (PDF)/AER.xdo?_xpf=&_xpt=1&_params%2FOracle%20BI%20EE%3A%3ADefaultApp%3A%3AEVVET3%20PR%20NEW%2FAER%3A%3Adimension%2FAER%20Id%3A%3Aattribute%3A%3Anoaggr%3A%3Axsd%3Adouble=20000141126&_xt=AER&_xf=pdf""> AER </a>",2023-03-21 00:00:00,Veterinarian,United Kingdom,MALE,Dog,Retriever - Golden,"Librela 10 mg - Solution for injection, Librela 15 mg - Solution for injection, Librela 20 mg - Solution for injection, Librela 30 mg - Solution for injection, Librela 5 mg - Solution for injection, Previcox 227 mg - Chewable tablet","Decreased urine concentration, Polydipsia, Polyuria, Proteinuria",1,1,
GBR-ZOETISPV-2023-UK-00868,"<a target=""_blank""  href=""/xmlpserver/EVVET3 PW NEW/Subject Area Contents/Public Website/Report (PDF)/AER.xdo?_xpf=&_xpt=1&_params%2FOracle%20BI%20EE%3A%3ADefaultApp%3A%3AEVVET3%20PR%20NEW%2FAER%3A%3Adimension%2FAER%20Id%3A%3Aattribute%3A%3Anoaggr%3A%3Axsd%3Adouble=20000146942&_xt=AER&_xf=pdf""> AER </a>",2023-04-05 00:00:00,Veterinarian,United Kingdom,MALE,Dog,Terrier - Jack Russell,"Librela 10 mg - Solution for injection, Librela 15 mg - Solution for injection, Librela 20 mg - Solution for injection, Librela 30 mg - Solution for injection, Librela 5 mg - Solution for injection, Previcox 57 mg - Chewable tablet",Corneal ulcer,1,1,
GBR-ZOETISPV-2023-UK-01042,"<a target=""_blank""  href=""/xmlpserver/EVVET3 PW NEW/Subject Area Contents/Public Website/Report (PDF)/AER.xdo?_xpf=&_xpt=1&_params%2FOracle%20BI%20EE%3A%3ADefaultApp%3A%3AEVVET3%20PR%20NEW%2FAER%3A%3Adimension%2FAER%20Id%3A%3Aattribute%3A%3Anoaggr%3A%3Axsd%3Adouble=20000155888&_xt=AER&_xf=pdf""> AER </a>",2023-04-19 00:00:00,Veterinarian,United Kingdom,MALE,Dog,Ridgeback - Rhodesian,"Librela 10 mg - Solution for injection, Librela 15 mg - Solution for injection, Librela 20 mg - Solution for injection, Librela 30 mg - Solution for injection, Librela 5 mg - Solution for injection, Previcox 227 mg - Chewable tablet",Skin lesion NOS,1,1,
GBR-ZOETISPV-2023-UK-01046,"<a target=""_blank""  href=""/xmlpserver/EVVET3 PW NEW/Subject Area Contents/Public Website/Report (PDF)/AER.xdo?_xpf=&_xpt=1&_params%2FOracle%20BI%20EE%3A%3ADefaultApp%3A%3AEVVET3%20PR%20NEW%2FAER%3A%3Adimension%2FAER%20Id%3A%3Aattribute%3A%3Anoaggr%3A%3Axsd%3Adouble=20000152914&_xt=AER&_xf=pdf""> AER </a>",2023-04-13 00:00:00,Veterinarian,United Kingdom,MALE,Dog,Siberian Husky,"Librela 10 mg - Solution for injection, Librela 15 mg - Solution for injection, Librela 20 mg - Solution for injection, Librela 30 mg - Solution for injection, Librela 5 mg - Solution for injection, Previcox 227 mg - Chewable tablet, Previcox 57 mg - Chewable tablet, Previcox 8.2 mg/g - Oral paste",Partial lack of efficacy,1,1,
GBR-ZOETISPV-2023-UK-01556,"<a target=""_blank""  href=""/xmlpserver/EVVET3 PW NEW/Subject Area Contents/Public Website/Report (PDF)/AER.xdo?_xpf=&_xpt=1&_params%2FOracle%20BI%20EE%3A%3ADefaultApp%3A%3AEVVET3%20PR%20NEW%2FAER%3A%3Adimension%2FAER%20Id%3A%3Aattribute%3A%3Anoaggr%3A%3Axsd%3Adouble=20000177409&_xt=AER&_xf=pdf""> AER </a>",2023-05-31 00:00:00,Veterinarian,United Kingdom,MALE,Dog,Pointer (unspecified),"Librela 10 mg - Solution for injection, Librela 15 mg - Solution for injection, Librela 20 mg - Solution for injection, Librela 30 mg - Solution for injection, Librela 5 mg - Solution for injection, Previcox 227 mg - Chewable tablet, Tralieve 20 mg chewable tablets for dogs, Tralieve 50 mg/ml solution for injection for dogs, Tralieve 80 mg chewable tablets for dogs, Tralieve 80 mg compresse masticabili per cani",Partial lack of efficacy,1,1,
GBR-ZOETISPV-2023-UK-01627,"<a target=""_blank""  href=""/xmlpserver/EVVET3 PW NEW/Subject Area Contents/Public Website/Report (PDF)/AER.xdo?_xpf=&_xpt=1&_params%2FOracle%20BI%20EE%3A%3ADefaultApp%3A%3AEVVET3%20PR%20NEW%2FAER%3A%3Adimension%2FAER%20Id%3A%3Aattribute%3A%3Anoaggr%3A%3Axsd%3Adouble=20000179557&_xt=AER&_xf=pdf""> AER </a>",2023-06-05 00:00:00,Veterinarian,United Kingdom,FEMALE,Dog,Retriever - Labrador,"Librela 10 mg - Solution for injection, Librela 15 mg - Solution for injection, Librela 20 mg - Solution for injection, Librela 30 mg - Solution for injection, Librela 5 mg - Solution for injection, Previcox 227 mg - Chewable tablet","Lethargy (see also Central nervous system depression in Neurological), Sleepiness - systemic disorder, Vacant",1,1,
GBR-ZOETISPV-2023-UK-01985,"<a target=""_blank""  href=""/xmlpserver/EVVET3 PW NEW/Subject Area Contents/Public Website/Report (PDF)/AER.xdo?_xpf=&_xpt=1&_params%2FOracle%20BI%20EE%3A%3ADefaultApp%3A%3AEVVET3%20PR%20NEW%2FAER%3A%3Adimension%2FAER%20Id%3A%3Aattribute%3A%3Anoaggr%3A%3Axsd%3Adouble=20000180982&_xt=AER&_xf=pdf""> AER </a>",2023-06-07 00:00:00,Veterinarian,United Kingdom,FEMALE,Dog,Rottweiler,"Librela 10 mg - Solution for injection, Librela 15 mg - Solution for injection, Librela 20 mg - Solution for injection, Librela 30 mg - Solution for injection, Librela 5 mg - Solution for injection, Previcox 227 mg - Chewable tablet, Previcox 57 mg - Chewable tablet, Previcox 8.2 mg/g - Oral paste",Partial lack of efficacy,1,1,
GBR-ZOETISPV-2023-UK-03714,"<a target=""_blank""  href=""/xmlpserver/EVVET3 PW NEW/Subject Area Contents/Public Website/Report (PDF)/AER.xdo?_xpf=&_xpt=1&_params%2FOracle%20BI%20EE%3A%3ADefaultApp%3A%3AEVVET3%20PR%20NEW%2FAER%3A%3Adimension%2FAER%20Id%3A%3Aattribute%3A%3Anoaggr%3A%3Axsd%3Adouble=20000254890&_xt=AER&_xf=pdf""> AER </a>",2023-10-25 00:00:00,Veterinarian,United Kingdom,FEMALE,Dog,Shepherd Dog - German,"Librela 10 mg - Solution for injection, Librela 15 mg - Solution for injection, Librela 20 mg - Solution for injection, Librela 30 mg - Solution for injection, Librela 5 mg - Solution for injection, Previcox 227 mg - Chewable tablet, Previcox 57 mg - Chewable tablet, Previcox 8.2 mg/g - Oral paste","Polydipsia, Urine leakage",1,1,
GBR-ZOETISPV-2023-UK-04040,"<a target=""_blank""  href=""/xmlpserver/EVVET3 PW NEW/Subject Area Contents/Public Website/Report (PDF)/AER.xdo?_xpf=&_xpt=1&_params%2FOracle%20BI%20EE%3A%3ADefaultApp%3A%3AEVVET3%20PR%20NEW%2FAER%3A%3Adimension%2FAER%20Id%3A%3Aattribute%3A%3Anoaggr%3A%3Axsd%3Adouble=20000266531&_xt=AER&_xf=pdf""> AER </a>",2023-11-13 00:00:00,Veterinarian,United Kingdom,FEMALE,Dog,Terrier - Jack Russell,"Librela 10 mg - Solution for injection, Librela 15 mg - Solution for injection, Librela 20 mg - Solution for injection, Librela 30 mg - Solution for injection, Librela 5 mg - Solution for injection, Previcox 227 mg - Chewable tablet, Previcox 57 mg - Chewable tablet, Previcox 8.2 mg/g - Oral paste","Colitis, Diarrhoea, Lethargy (see also Central nervous system depression in Neurological), Panting, Pyrexia, Shaking, Vomiting",1,1,
GBR-ZOETISPV-2023-UK-04041,"<a target=""_blank""  href=""/xmlpserver/EVVET3 PW NEW/Subject Area Contents/Public Website/Report (PDF)/AER.xdo?_xpf=&_xpt=1&_params%2FOracle%20BI%20EE%3A%3ADefaultApp%3A%3AEVVET3%20PR%20NEW%2FAER%3A%3Adimension%2FAER%20Id%3A%3Aattribute%3A%3Anoaggr%3A%3Axsd%3Adouble=20000266578&_xt=AER&_xf=pdf""> AER </a>",2023-11-13 00:00:00,Veterinarian,United Kingdom,FEMALE,Dog,Terrier - Jack Russell,"Librela 10 mg - Solution for injection, Librela 15 mg - Solution for injection, Librela 20 mg - Solution for injection, Librela 30 mg - Solution for injection, Librela 5 mg - Solution for injection, Previcox 227 mg - Chewable tablet, Previcox 57 mg - Chewable tablet, Previcox 8.2 mg/g - Oral paste","Injection site erythema, Itchy skin",1,1,
HUN-BIAHPV1P-23HU000010,"<a target=""_blank""  href=""/xmlpserver/EVVET3 PW NEW/Subject Area Contents/Public Website/Report (PDF)/AER.xdo?_xpf=&_xpt=1&_params%2FOracle%20BI%20EE%3A%3ADefaultApp%3A%3AEVVET3%20PR%20NEW%2FAER%3A%3Adimension%2FAER%20Id%3A%3Aattribute%3A%3Anoaggr%3A%3Axsd%3Adouble=20000146193&_xt=AER&_xf=pdf""> AER </a>",2023-04-04 00:00:00,Animal owner,Hungary,MALE,Dog,Pointing Dog - Hungarian Short-haired (Vizsla),Previcox 227 mg - Chewable tablet,"Anaemia NOS, Bloodshot eye, Bloody diarrhoea, Brain disorder NOS, Death, Generalised weakness, Lethargy (see also Central nervous system depression in Neurological), Partial anorexia, Tachycardia, Vomiting",1,1,1
ISR-MERCKMSD-2023-IL-00014,"<a target=""_blank""  href=""/xmlpserver/EVVET3 PW NEW/Subject Area Contents/Public Website/Report (PDF)/AER.xdo?_xpf=&_xpt=1&_params%2FOracle%20BI%20EE%3A%3ADefaultApp%3A%3AEVVET3%20PR%20NEW%2FAER%3A%3Adimension%2FAER%20Id%3A%3Aattribute%3A%3Anoaggr%3A%3Axsd%3Adouble=20000159088&_xt=AER&_xf=pdf""> AER </a>",2023-04-26 00:00:00,Veterinarian,Israel,FEMALE,Dog,Retriever - Golden,"Bravecto 1000 mg - Chewable tablet, Previcox 227 mg - Chewable tablet, Previcox 57 mg - Chewable tablet, Previcox 8.2 mg/g - Oral paste","Death, Lying down, Respiratory tract disorder NOS",1,1,1
ISR-ZOETISPV-2023-IL-00040,"<a target=""_blank""  href=""/xmlpserver/EVVET3 PW NEW/Subject Area Contents/Public Website/Report (PDF)/AER.xdo?_xpf=&_xpt=1&_params%2FOracle%20BI%20EE%3A%3ADefaultApp%3A%3AEVVET3%20PR%20NEW%2FAER%3A%3Adimension%2FAER%20Id%3A%3Aattribute%3A%3Anoaggr%3A%3Axsd%3Adouble=20000186827&_xt=AER&_xf=pdf""> AER </a>",2023-06-19 00:00:00,Veterinarian,Israel,MALE,Dog,Mixed (Dog),"DOMITOR 1 mg/ml raztopina za injiciranje za pse in mačke, DOMITOR 1 mg/ml ενέσιμο διάλυμα για σκύλους και γάτες, DOMITOR 1 mg/ml, soluție injectabilă pentru câini și pisici, DOMITOR, 1mg/ml, Injekční roztok, DOMITOR, SOLUTION INJECTABLE, Domitor, Domitor 1 mg/1 ml, roztwór do wstrzykiwań dla psów i kotów, Domitor 1 mg/mL, Domitor 1 mg/ml - Injektionslösung für Hunde und Katzen, Domitor 1 mg/ml Oplossing voor injectie, Domitor 1 mg/ml Solution injectable, Domitor 1 mg/ml injekčný roztok, Domitor 1 mg/ml oldatos injekció kutyáknak és macskáknak A.U.V., Domitor 1 mg/ml solution for injection, Domitor 1 mg/ml soluzione iniettabile per cani e gatti, Domitor Vet 1 mg/ml injekcinis tirpalas, Domitor Vet 1 mg/ml šķīdums injekcijām, Domitor Vet, 1 mg/ml süstelahus, Domitor Vet. 1 mg/ml injektionsvæske, opløsning, Domitor vet 1 mg/ml injektioneste, liuos, Domitor vet. 1 mg/ml Injektionsvätska, lösning, Domitor vet. 1 mg/ml injeksjonsvæske, oppløsning til hund og katt, Librela 30 mg - Solution for injection, Previcox 227 mg - Chewable tablet, Previcox 57 mg - Chewable tablet, Previcox 8.2 mg/g - Oral paste, Домитор Вет 1 mg/ml инжекционен разтвор за кучета и котки","Convulsion, Disorientation, Loss of consciousness, Unsteady gait, Vomiting",1,1,
ITA-BIAHPV1P-23IT000071,"<a target=""_blank""  href=""/xmlpserver/EVVET3 PW NEW/Subject Area Contents/Public Website/Report (PDF)/AER.xdo?_xpf=&_xpt=1&_params%2FOracle%20BI%20EE%3A%3ADefaultApp%3A%3AEVVET3%20PR%20NEW%2FAER%3A%3Adimension%2FAER%20Id%3A%3Aattribute%3A%3Anoaggr%3A%3Axsd%3Adouble=20000187941&_xt=AER&_xf=pdf""> AER </a>",2023-06-20 00:00:00,Veterinarian,Italy,FEMALE,Dog,Pinscher - Miniature,"Meloxidyl 0.5 mg/ml  - Oral suspension, Meloxidyl 1.5 mg/ml  - Oral suspension, Meloxidyl 20 mg/ml  - Solution for injection, Meloxidyl 20 mg/ml oplossing voor injectie voor runderen en varkens, Meloxidyl 5 mg/ml  - Solution for injection, Previcox 57 mg - Chewable tablet","Buccal ulceration, Inappetence, Renal disorder NOS",1,1,
ITA-BIAHPV1P-23IT000143,"<a target=""_blank""  href=""/xmlpserver/EVVET3 PW NEW/Subject Area Contents/Public Website/Report (PDF)/AER.xdo?_xpf=&_xpt=1&_params%2FOracle%20BI%20EE%3A%3ADefaultApp%3A%3AEVVET3%20PR%20NEW%2FAER%3A%3Adimension%2FAER%20Id%3A%3Aattribute%3A%3Anoaggr%3A%3Axsd%3Adouble=20000223991&_xt=AER&_xf=pdf""> AER </a>",2023-08-28 00:00:00,Veterinarian,Italy,MALE,Dog,Griffon - Brussels,Previcox 57 mg - Chewable tablet,Sleepiness - systemic disorder,1,1,
ITA-BIAHPV1P-23IT000206,"<a target=""_blank""  href=""/xmlpserver/EVVET3 PW NEW/Subject Area Contents/Public Website/Report (PDF)/AER.xdo?_xpf=&_xpt=1&_params%2FOracle%20BI%20EE%3A%3ADefaultApp%3A%3AEVVET3%20PR%20NEW%2FAER%3A%3Adimension%2FAER%20Id%3A%3Aattribute%3A%3Anoaggr%3A%3Axsd%3Adouble=20000284518&_xt=AER&_xf=pdf""> AER </a>",2023-12-20 00:00:00,Veterinarian,Italy,FEMALE,Dog,Crossbred Canine/dog,Previcox 227 mg - Chewable tablet,Diarrhoea,1,1,
ITA-BIAHPV1P-23IT000207,"<a target=""_blank""  href=""/xmlpserver/EVVET3 PW NEW/Subject Area Contents/Public Website/Report (PDF)/AER.xdo?_xpf=&_xpt=1&_params%2FOracle%20BI%20EE%3A%3ADefaultApp%3A%3AEVVET3%20PR%20NEW%2FAER%3A%3Adimension%2FAER%20Id%3A%3Aattribute%3A%3Anoaggr%3A%3Axsd%3Adouble=20000284426&_xt=AER&_xf=pdf""> AER </a>",2023-12-20 00:00:00,Veterinarian,Italy,MALE,Dog,Shepherd Dog - German,Previcox 227 mg - Chewable tablet,Bloody diarrhoea,1,1,
ITA-BIAHPV1P-23IT000208,"<a target=""_blank""  href=""/xmlpserver/EVVET3 PW NEW/Subject Area Contents/Public Website/Report (PDF)/AER.xdo?_xpf=&_xpt=1&_params%2FOracle%20BI%20EE%3A%3ADefaultApp%3A%3AEVVET3%20PR%20NEW%2FAER%3A%3Adimension%2FAER%20Id%3A%3Aattribute%3A%3Anoaggr%3A%3Axsd%3Adouble=20000284424&_xt=AER&_xf=pdf""> AER </a>",2023-12-20 00:00:00,Veterinarian,Italy,MALE,Dog,Crossbred Canine/dog,Previcox 227 mg - Chewable tablet,Diarrhoea,1,1,
ITA-ZOETISPV-2023-IT-00087,"<a target=""_blank""  href=""/xmlpserver/EVVET3 PW NEW/Subject Area Contents/Public Website/Report (PDF)/AER.xdo?_xpf=&_xpt=1&_params%2FOracle%20BI%20EE%3A%3ADefaultApp%3A%3AEVVET3%20PR%20NEW%2FAER%3A%3Adimension%2FAER%20Id%3A%3Aattribute%3A%3Anoaggr%3A%3Axsd%3Adouble=20000190569&_xt=AER&_xf=pdf""> AER </a>",2023-06-26 00:00:00,Veterinarian,Italy,MALE,Dog,Crossbred Canine/dog,"Librela 10 mg - Solution for injection, Librela 15 mg - Solution for injection, Librela 20 mg - Solution for injection, Librela 30 mg - Solution for injection, Librela 5 mg - Solution for injection, Previcox 227 mg - Chewable tablet, Previcox 57 mg - Chewable tablet, Previcox 8.2 mg/g - Oral paste","Decreased appetite, Emesis (multiple), Falling, Hind limb paresis, Unable to stand",1,1,
JPN-BIAHPV1P-16JP001070,"<a target=""_blank""  href=""/xmlpserver/EVVET3 PW NEW/Subject Area Contents/Public Website/Report (PDF)/AER.xdo?_xpf=&_xpt=1&_params%2FOracle%20BI%20EE%3A%3ADefaultApp%3A%3AEVVET3%20PR%20NEW%2FAER%3A%3Adimension%2FAER%20Id%3A%3Aattribute%3A%3Anoaggr%3A%3Axsd%3Adouble=20000199181&_xt=AER&_xf=pdf""> AER </a>",2023-07-11 00:00:00,Veterinarian,Japan,MALE,Dog,Sheepdog - Shetland,Previcox 57 mg - Chewable tablet,"Anuria, Death, Elevated C-reactive protein, Elevated blood urea nitrogen (BUN), Elevated creatinine, Hyperphosphataemia, Lethargy (see also Central nervous system depression in Neurological), Unwell, Vomiting",1,1,1
JPN-BIAHPV1P-16JP001072,"<a target=""_blank""  href=""/xmlpserver/EVVET3 PW NEW/Subject Area Contents/Public Website/Report (PDF)/AER.xdo?_xpf=&_xpt=1&_params%2FOracle%20BI%20EE%3A%3ADefaultApp%3A%3AEVVET3%20PR%20NEW%2FAER%3A%3Adimension%2FAER%20Id%3A%3Aattribute%3A%3Anoaggr%3A%3Axsd%3Adouble=20000199165&_xt=AER&_xf=pdf""> AER </a>",2023-07-11 00:00:00,Veterinarian,Japan,MALE,Dog,Collie - Border,Previcox 227 mg - Chewable tablet,"Death, Devitalisation, Elevated renal parameters, Vomiting",1,1,1
JPN-BIAHPV1P-23JP000108,"<a target=""_blank""  href=""/xmlpserver/EVVET3 PW NEW/Subject Area Contents/Public Website/Report (PDF)/AER.xdo?_xpf=&_xpt=1&_params%2FOracle%20BI%20EE%3A%3ADefaultApp%3A%3AEVVET3%20PR%20NEW%2FAER%3A%3Adimension%2FAER%20Id%3A%3Aattribute%3A%3Anoaggr%3A%3Axsd%3Adouble=20000161282&_xt=AER&_xf=pdf""> AER </a>",2023-05-02 00:00:00,Veterinarian,Japan,MALE,Dog,"Crossbred Canine/dog, Retriever - Labrador",Previcox 227 mg - Chewable tablet,"Diarrhoea, Tarry or black stool (see also haemorrhagic diarrhoea)",1,1,
JPN-BIAHPV1P-23JP000152,"<a target=""_blank""  href=""/xmlpserver/EVVET3 PW NEW/Subject Area Contents/Public Website/Report (PDF)/AER.xdo?_xpf=&_xpt=1&_params%2FOracle%20BI%20EE%3A%3ADefaultApp%3A%3AEVVET3%20PR%20NEW%2FAER%3A%3Adimension%2FAER%20Id%3A%3Aattribute%3A%3Anoaggr%3A%3Axsd%3Adouble=20000171957&_xt=AER&_xf=pdf""> AER </a>",2023-05-22 00:00:00,Veterinarian,Japan,FEMALE,Dog,Spaniel - King Charles Cavalier,"Galliprant 100 mg - Tablet, Galliprant 20 mg - Tablet, Galliprant 60 mg - Tablet, Previcox 57 mg - Chewable tablet",Tachypnoea,1,1,
JPN-BIAHPV1P-23JP000202,"<a target=""_blank""  href=""/xmlpserver/EVVET3 PW NEW/Subject Area Contents/Public Website/Report (PDF)/AER.xdo?_xpf=&_xpt=1&_params%2FOracle%20BI%20EE%3A%3ADefaultApp%3A%3AEVVET3%20PR%20NEW%2FAER%3A%3Adimension%2FAER%20Id%3A%3Aattribute%3A%3Anoaggr%3A%3Axsd%3Adouble=20000180595&_xt=AER&_xf=pdf""> AER </a>",2023-06-06 00:00:00,Veterinarian,Japan,MALE,Dog,Rottweiler,Previcox 227 mg - Chewable tablet,"Death, Distension of abdomen, Gastric perforation, Vomiting",1,1,1
JPN-BIAHPV1P-23JP000203,"<a target=""_blank""  href=""/xmlpserver/EVVET3 PW NEW/Subject Area Contents/Public Website/Report (PDF)/AER.xdo?_xpf=&_xpt=1&_params%2FOracle%20BI%20EE%3A%3ADefaultApp%3A%3AEVVET3%20PR%20NEW%2FAER%3A%3Adimension%2FAER%20Id%3A%3Aattribute%3A%3Anoaggr%3A%3Axsd%3Adouble=20000180576&_xt=AER&_xf=pdf""> AER </a>",2023-06-06 00:00:00,Veterinarian,Japan,MALE,Dog,Retriever - Labrador,Previcox 227 mg - Chewable tablet,"Anorexia, Death, Distension of abdomen, Elevated C-reactive protein, Elevated renal parameters, Gastric perforation, Leucopenia NOS, Vomiting",1,1,1
JPN-BIAHPV1P-23JP000221,"<a target=""_blank""  href=""/xmlpserver/EVVET3 PW NEW/Subject Area Contents/Public Website/Report (PDF)/AER.xdo?_xpf=&_xpt=1&_params%2FOracle%20BI%20EE%3A%3ADefaultApp%3A%3AEVVET3%20PR%20NEW%2FAER%3A%3Adimension%2FAER%20Id%3A%3Aattribute%3A%3Anoaggr%3A%3Axsd%3Adouble=20000184843&_xt=AER&_xf=pdf""> AER </a>",2023-06-14 00:00:00,Veterinarian,Japan,FEMALE,Dog,Poodle - Toy,"Apoquel 16 mg - Chewable tablet, Apoquel 16 mg - Film-coated tablet, Apoquel 3.6 mg - Chewable tablet, Apoquel 3.6 mg - Film-coated tablet, Apoquel 5.4 mg - Chewable tablet, Apoquel 5.4 mg - Film-coated tablet, Metacam 5 mg/ml - Solution for injection (cats, dogs), Metacam 5 mg/ml - Solution for injection (cattle, pigs), Metacam 5 mg/ml - Solution for injection (dogs), Previcox 57 mg - Chewable tablet","Anorexia, Blood in faeces, Elevated C-reactive protein, Elevated amylase, Leucocytosis NOS",1,1,
JPN-BIAHPV1P-23JP000234,"<a target=""_blank""  href=""/xmlpserver/EVVET3 PW NEW/Subject Area Contents/Public Website/Report (PDF)/AER.xdo?_xpf=&_xpt=1&_params%2FOracle%20BI%20EE%3A%3ADefaultApp%3A%3AEVVET3%20PR%20NEW%2FAER%3A%3Adimension%2FAER%20Id%3A%3Aattribute%3A%3Anoaggr%3A%3Axsd%3Adouble=20000188698&_xt=AER&_xf=pdf""> AER </a>",2023-06-21 00:00:00,Veterinarian,Japan,UNKNOWN,Dog,Terrier - Norfolk,Previcox 57 mg - Chewable tablet,"Death, Digestive tract disorder NOS, Renal failure",1,1,1
JPN-BIAHPV1P-23JP000235,"<a target=""_blank""  href=""/xmlpserver/EVVET3 PW NEW/Subject Area Contents/Public Website/Report (PDF)/AER.xdo?_xpf=&_xpt=1&_params%2FOracle%20BI%20EE%3A%3ADefaultApp%3A%3AEVVET3%20PR%20NEW%2FAER%3A%3Adimension%2FAER%20Id%3A%3Aattribute%3A%3Anoaggr%3A%3Axsd%3Adouble=20000205741&_xt=AER&_xf=pdf""> AER </a>",2023-07-24 00:00:00,Veterinarian,Japan,UNKNOWN,Dog,Terrier - Norfolk,Previcox 57 mg - Chewable tablet,"Death, Digestive tract disorder NOS, Renal failure",1,1,1
JPN-BIAHPV1P-23JP000285,"<a target=""_blank""  href=""/xmlpserver/EVVET3 PW NEW/Subject Area Contents/Public Website/Report (PDF)/AER.xdo?_xpf=&_xpt=1&_params%2FOracle%20BI%20EE%3A%3ADefaultApp%3A%3AEVVET3%20PR%20NEW%2FAER%3A%3Adimension%2FAER%20Id%3A%3Aattribute%3A%3Anoaggr%3A%3Axsd%3Adouble=20000196033&_xt=AER&_xf=pdf""> AER </a>",2023-07-04 00:00:00,Veterinarian,Japan,MALE,Dog,Chihuahua,Previcox 57 mg - Chewable tablet,"Death, Decreased appetite, Diarrhoea, Elevated C-reactive protein, Foaming at the mouth, Staggering, Tarry or black stool (see also haemorrhagic diarrhoea), Vomiting",1,1,1
JPN-BIAHPV1P-23JP000292,"<a target=""_blank""  href=""/xmlpserver/EVVET3 PW NEW/Subject Area Contents/Public Website/Report (PDF)/AER.xdo?_xpf=&_xpt=1&_params%2FOracle%20BI%20EE%3A%3ADefaultApp%3A%3AEVVET3%20PR%20NEW%2FAER%3A%3Adimension%2FAER%20Id%3A%3Aattribute%3A%3Anoaggr%3A%3Axsd%3Adouble=20000204343&_xt=AER&_xf=pdf""> AER </a>",2023-07-20 00:00:00,Veterinarian,Japan,MALE,Dog,Sheepdog - Shetland,Previcox 57 mg - Chewable tablet,"Blood in faeces, Loose stool",1,1,
JPN-BIAHPV1P-23JP000553,"<a target=""_blank""  href=""/xmlpserver/EVVET3 PW NEW/Subject Area Contents/Public Website/Report (PDF)/AER.xdo?_xpf=&_xpt=1&_params%2FOracle%20BI%20EE%3A%3ADefaultApp%3A%3AEVVET3%20PR%20NEW%2FAER%3A%3Adimension%2FAER%20Id%3A%3Aattribute%3A%3Anoaggr%3A%3Axsd%3Adouble=20000239405&_xt=AER&_xf=pdf""> AER </a>",2023-09-26 00:00:00,Veterinarian,Japan,FEMALE,Dog,Corgi - Welsh Cardigan,Previcox 57 mg - Chewable tablet,"Cloudy eye (for Miosis, Mydriasis, Anisocoria, Nystagmus - see Neurological)",1,1,
JPN-BIAHPV1P-23JP000620,"<a target=""_blank""  href=""/xmlpserver/EVVET3 PW NEW/Subject Area Contents/Public Website/Report (PDF)/AER.xdo?_xpf=&_xpt=1&_params%2FOracle%20BI%20EE%3A%3ADefaultApp%3A%3AEVVET3%20PR%20NEW%2FAER%3A%3Adimension%2FAER%20Id%3A%3Aattribute%3A%3Anoaggr%3A%3Axsd%3Adouble=20000254933&_xt=AER&_xf=pdf""> AER </a>",2023-10-24 00:00:00,Veterinarian,Japan,MALE,Dog,Unknown,"Convenia 80 mg/ml  - Powder and solvent for solution for injection, Previcox 57 mg - Chewable tablet","Anaemia NOS, Death, Disseminated intravascular coagulation, Elevated renal parameters, Elevated total bilirubin, Hypotension, Leucopenia NOS, Low platelet count, Melaena, Septicaemia, Ulceration NOS, Vomiting",1,1,1
JPN-BIAHPV1P-23JP000684,"<a target=""_blank""  href=""/xmlpserver/EVVET3 PW NEW/Subject Area Contents/Public Website/Report (PDF)/AER.xdo?_xpf=&_xpt=1&_params%2FOracle%20BI%20EE%3A%3ADefaultApp%3A%3AEVVET3%20PR%20NEW%2FAER%3A%3Adimension%2FAER%20Id%3A%3Aattribute%3A%3Anoaggr%3A%3Axsd%3Adouble=20000271360&_xt=AER&_xf=pdf""> AER </a>",2023-11-25 00:00:00,Veterinarian,Japan,UNKNOWN,Dog,Dog (unknown),Previcox 227 mg - Chewable tablet,Vomiting,1,1,
